id,conversation_id,tweet,username,user_id,date,time,likes_count,replies_count,retweets_count,hashtags,mentions,retweet,quote_url,user_rt_id,source,retweet_date
1168926049859756035,1168926049859756035,"游늷 @pedrobek presenta Neurociencia para nunca cambiar de opini칩n. 游딉  Jueves 12/09 낋 18:30hs 游닄 Participan: @soyingridbeck, Fabricio Ballarini y @norabar    游늸 Instituto Baikal. Inscripci칩n:  https://t.co/OTGavCJuc5  https://t.co/ocOUhVTPod",megustaleerarg,316429650,2019-09-03,13:37:42,15,3,3,[],"[{'screen_name': 'pedrobek', 'name': '游눜pedro bek游눜', 'id': '166722572'}, {'screen_name': 'soyingridbeck', 'name': '游눜 洧딒洧딭洧딦洧洧딨洧딤 洧딋洧쓇롕썷롕 游눜', 'id': '329699082'}, {'screen_name': 'norabar', 'name': 'nora b칛r', 'id': '130979339'}]",False,,,,
1168615501133750274,1168615501133750274,"Las 80 pel칤culas favoritas de Quentin Tarantino en Cielo drive, el nuevo libro de @SebaDeCaro:  https://t.co/9GQczYTCmx  https://t.co/AEHEgEnRxE",megustaleerarg,316429650,2019-09-02,17:03:41,24,0,3,[],"[{'screen_name': 'sebadecaro', 'name': 'seba de caro', 'id': '29715245'}]",False,,,,
1168606430733197313,1168606430733197313,"La p치gina en blanco o De las ganas, extracto de La trastienda de la escritura, el esperado libro de Liliana Heker sobre su experiencia en talleres de escritura:  https://t.co/b0McicjSmY  https://t.co/F8zU0nzfuB",megustaleerarg,316429650,2019-09-02,16:27:39,6,0,1,[],[],False,,,,
1168520722244866053,1168520722244866053,"En #SEPTIEMBRE en librer칤as El arpa de hierba, con el estilo inconfundible de Truman Capote, una obra clave de su universo literario y pieza fundamental para valorar su aporte a la narrativa contempor치nea:  https://t.co/2yo7GTUxSX  https://t.co/vfhhcZO7Ca",megustaleerarg,316429650,2019-09-02,10:47:04,5,1,0,['septiembre'],[],False,,,,
1168490753384964097,1168490753384964097,游늷 @AngieSammartino presenta su libro Todxs tenemos un amor pendiente en la Feria Internacional del Libro de Neuqu칠n    游딉 Domingo 08/09 낋 17:30hs. 游늸 Museo Nacional de Bellas Artes  https://t.co/2upTdnb1pE,megustaleerarg,316429650,2019-09-02,08:47:59,0,0,1,[],"[{'screen_name': 'angiesammartino', 'name': 'angie sammartino', 'id': '281030897'}]",False,,,,
1168158722138476545,1168158722138476545,"Juan Sasturain, autor de El 칰ltimo Hammett, en el suplemento cultural de @perfildiario.  https://t.co/IQ5A2pE2NF",megustaleerarg,316429650,2019-09-01,10:48:37,13,0,3,[],"[{'screen_name': 'perfildiario', 'name': 'diario perfil', 'id': '175881965'}]",False,,,,
1167485249569329152,1167485249569329152,"Retrato pol칤tico de Miguel 츼ngel Pichetto, el gobernador del Palacio, en Los secretos del Congreso, de @gsued en @LANACION:  https://t.co/Mgmpm0E0z3   游녤 M치s sobre el libro:  https://t.co/PpUk28a6Ea  https://t.co/DZFNGaFWbC",megustaleerarg,316429650,2019-08-30,14:12:28,16,0,3,[],"[{'screen_name': 'gsued', 'name': 'gabriel sued', 'id': '148078014'}, {'screen_name': 'lanacion', 'name': 'la nacion', 'id': '33989170'}]",False,,,,
1167475313024147461,1167475313024147461,游늷 @Tutehumor presenta su libro Diario de un hijo en la Feria Internacional del Libro de Neuqu칠n    游딉 S치bado 07/09 낋 18hs. 游늸 Museo Nacional de Bellas Artes  https://t.co/1HDcqSCMH7,megustaleerarg,316429650,2019-08-30,13:32:59,42,0,7,[],"[{'screen_name': 'tutehumor', 'name': 'tute', 'id': '77925638'}]",False,,,,
1167431051532296192,1167431051532296192,游눪游닄춰Nuestras novedades editoriales de #SEPTIEMBRE!    https://t.co/D1pBkMMBIj  https://t.co/nNwcUFbkY6,megustaleerarg,316429650,2019-08-30,10:37:07,9,0,6,['septiembre'],[],False,,,,
1167429177995333632,1167429177995333632,"Las 80 pel칤culas favoritas de Quentin Tarantino en Cielo drive, el nuevo libro de @SebaDeCaro:  https://t.co/9GQczYTCmx  https://t.co/kbEFpBIOzF",megustaleerarg,316429650,2019-08-30,10:29:40,22,1,3,[],"[{'screen_name': 'sebadecaro', 'name': 'seba de caro', 'id': '29715245'}]",False,,,,
1167420888758853632,1167420888758853632,"Despu칠s de vender m치s de 10 millones de ejemplares, Ildefonso Falcones vuelve con una fascinante novela.  Una poderosa historia de amor, pasi칩n por el arte, revueltas sociales y venganza en la Barcelona modernista.  https://t.co/AeEwmWP0gF",megustaleerarg,316429650,2019-08-30,09:56:44,5,0,0,[],[],False,,,,
1167162860700667904,1167162860700667904,"En #SEPTIEMBRE: Perfiles filos칩fico-pol칤ticos, de J칲rgen Habermas. Una apasionante y apasionada historia de una parte decisiva de la filosof칤a contempor치nea que ilumina la complejidad de los motivos que confluyen en la obra de Habermas:  https://t.co/8nFv8QgUct  https://t.co/vDb964i0g0",megustaleerarg,316429650,2019-08-29,16:51:25,3,0,0,['septiembre'],[],False,,,,
1167121931096776704,1167121931096776704,"Jorge Luis Borges habla del valor de la biblioteca de su padre  游닠 Archivo | Entrevista de Joaqu칤n Soler Serrano en el programa A fondo, de Televisi칩n Espa침ola (TVE), en 1980:  https://t.co/ECuE1KdpyH  https://t.co/4x4WO4WbOt",megustaleerarg,316429650,2019-08-29,14:08:47,18,0,6,[],[],False,,,,
1167040608646643713,1167040608646643713,"游꿀춰SORTEO! 游뱌Tenemos 20 pares de entradas la avant-premi칟re de IT 2, la segunda parte de la pel칤cula basada en el best seller de @StephenKing.  游녤游낕 Complet치 tus datos y ya est치s participando:  https://t.co/Z2drmHFInm  https://t.co/lf0CNrKVXE",megustaleerarg,316429650,2019-08-29,08:45:38,11,3,5,[],"[{'screen_name': 'stephenking', 'name': 'stephen king', 'id': '2233154425'}]",False,,,,
1166774731686776832,1166774731686776832,En #SEPTIEMBRE: 쯈u칠 puede hacer una joven para conquistar el coraz칩n de un hombre enamorado de otra mujer? Alma gitana es la cr칩nica deliciosa de un amor predestinado. Como solo @AndreaMilano lo sabe hacer:  https://t.co/KxzUrhjvFN  https://t.co/6E1X6PpCKG,megustaleerarg,316429650,2019-08-28,15:09:08,6,0,3,['septiembre'],"[{'screen_name': 'andreamilano', 'name': 'andrea milano oficial', 'id': '37482611'}]",False,,,,
1166771776577265664,1166771776577265664,"A 120 a침os del nacimiento de Jorge Luis Borges sorteamos tres packs con sus libros El Aleph, Historia universal de la infamia y Ficciones.  춰Complet치 la TRIVIA y ya est치s participando! 游녤游낕  https://t.co/dQIE8x5a7Q  https://t.co/Nt6k43qkvN",megustaleerarg,316429650,2019-08-28,14:57:23,13,0,3,[],[],False,,,,
1166724977841909761,1166724977841909761,"游꿀 춰SORTEO! 游뱌 Tenemos 20 pares de entradas la avant-premi칟re de IT 2, la segunda parte de la pel칤cula basada en el best seller de @StephenKing.  游녤游낕 Complet치 tus datos y ya est치s participando:  https://t.co/Z2drmHFInm  https://t.co/SKFsBBVVvV",megustaleerarg,316429650,2019-08-28,11:51:26,17,1,7,[],"[{'screen_name': 'stephenking', 'name': 'stephen king', 'id': '2233154425'}]",False,,,,
1166713878975266816,1166713878975266816,游늷 @Jimena_LaTorre presenta Predicciones 2019 y El peque침o gran libro del tarot en la Feria Internacional del Libro de Neuqu칠n    游딉  Jueves 05/09 낋 19hs. 游늸 Museo Nacional de Bellas Artes  https://t.co/fFwvXZCg2R,megustaleerarg,316429650,2019-08-28,11:07:19,0,0,0,[],"[{'screen_name': 'jimena_latorre', 'name': 'jimena la torre', 'id': '396745016'}]",False,,,,
1166706727011704833,1166706727011704833,"En #SEPTIEMBRE: Renovate con Confianza Total, de Florencia Andr칠s y Ver칩nica de Andr칠s. Viv칤s ocup치ndote de otros: tu familia, tu trabajo, tu casa, tus clientes, tu socio, tu jefe, tus parientes... Es hora de que te ocupes de vos:   https://t.co/yKxeMH3how  https://t.co/DehESxVNYd",megustaleerarg,316429650,2019-08-28,10:38:54,2,0,0,['septiembre'],[],False,,,,
1166700771058049026,1166700771058049026,游닠 @AgusBazterrica  responde el cuestionario:  https://t.co/5tlmCWDdBF    九덢잺 쮺u치l es el primer libro que record치s haber le칤do? 九덢잺 쮸 qu칠 preferir칤as dedicarte en lugar de escribir? 九덢잺 쮺u치l es el libro que m치s has regalado? 九덢잺쯈u칠 escritor vivo admir치s m치s? 九덢잺 쯈u칠 est치s leyendo?  https://t.co/EABnD7QecS,megustaleerarg,316429650,2019-08-28,10:15:14,2,0,0,[],"[{'screen_name': 'agusbazterrica', 'name': 'agustina bazterrica游눜游낍勇끂u200d游깯', 'id': '409594673'}]",False,,,,
1166440903906615299,1166440903906615299,"游꿀춰SORTEO! 游뱌 Tenemos 20 pares de entradas la avant-premi칟re de IT 2, la segunda parte de la pel칤cula basada en el best seller de @StephenKing.   游녤游낕 Complet치 tus datos y ya est치s participando:  https://t.co/Z2drmHFInm  https://t.co/BpKWjMxDUr",megustaleerarg,316429650,2019-08-27,17:02:37,18,2,5,[],"[{'screen_name': 'stephenking', 'name': 'stephen king', 'id': '2233154425'}]",False,,,,
1166435552108908544,1166435552108908544,游늷 @BernasconiPablo presenta El Infinito en la Feria Internacional del Libro de Neuqu칠n    游딉  Jueves 05/09 낋 18hs. 游늸 Museo Nacional de Bellas Artes  https://t.co/VkLYxblQu5,megustaleerarg,316429650,2019-08-27,16:41:21,3,0,1,[],"[{'screen_name': 'bernasconipablo', 'name': 'pablo bernasconi', 'id': '486881307'}]",False,,,,
1166429856449609728,1166429856449609728,"En #SEPTIEMBRE: el esperado libro de Liliana Heker sobre su experiencia en talleres de escritura, una pr치ctica que realiza desde hace m치s de cuarenta a침os y por donde han pasado muchos de los escritores m치s reconocidos de la actualidad argentina  https://t.co/c1mZSQIOAx  https://t.co/7H8adhuypl",megustaleerarg,316429650,2019-08-27,16:18:43,16,1,4,['septiembre'],[],False,,,,
1166428516667330560,1166428516667330560,游닠 @AgusBazterrica responde el cuestionario:  https://t.co/5tlmCWDdBF    九덢잺 쮺u치l es el primer libro que record치s haber le칤do? 九덢잺 쮸 qu칠 preferir칤as dedicarte en lugar de escribir? 九덢잺 쮺u치l es el libro que m치s has regalado? 九덢잺쯈u칠 escritor vivo admir치s m치s? 九덢잺 쯈u칠 est치s leyendo?  https://t.co/zp42N9tHey,megustaleerarg,316429650,2019-08-27,16:13:24,5,1,2,[],"[{'screen_name': 'agusbazterrica', 'name': 'agustina bazterrica游눜游낍勇끂u200d游깯', 'id': '409594673'}]",False,,,,
1166398130469912576,1166398130469912576,"A 120 a침os del nacimiento de Jorge Luis Borges sorteamos tres packs con sus libros El Aleph, Historia universal de la infamia y Ficciones.  춰Complet치 la TRIVIA y ya est치s participando! 游녤游낕  https://t.co/dQIE8x5a7Q  https://t.co/o5UPrpej1r",megustaleerarg,316429650,2019-08-27,14:12:39,20,1,3,[],[],False,,,,
1166356901799612417,1166356901799612417,Truman Capote (30/09/1924 - 25/08/1984) periodista y escritor estadounidense  https://t.co/vtsGsiNEgY  https://t.co/ioPZl63WgU,megustaleerarg,316429650,2019-08-27,11:28:49,8,0,2,[],[],False,,,,
1166349695305883649,1166349695305883649,"En #SEPTIEMBRE: el libro que rechaza la versi칩n oficial para contar la historia verdadera de Charles Manson y de los asesinatos perpetrados por la familia Manson, ofreciendo cientos de pruebas y documentos del FBI y la CIA nunca antes revelados:  https://t.co/orvfud4yXK  https://t.co/50cYDe7chO",megustaleerarg,316429650,2019-08-27,11:00:11,12,1,2,['septiembre'],[],False,,,,
1166344285584863236,1166344285584863236,游늷 Ricardo Canaletti presenta Cr칤menes sorprendentes de la clase alta argentina en la Feria Internacional del Libro de Neuqu칠n    游딉  Domingo 01/09 낋 20:30hs 游늸 Museo Nacional de Bellas Artes  https://t.co/3x4wedcaUV,megustaleerarg,316429650,2019-08-27,10:38:41,0,0,0,[],[],False,,,,
1166334908475879427,1166334908475879427,"En #SEPTIEMBRE: el resultado de un esfuerzo por radiografiar, con honestidad y compromiso con el lector, un lugar inigualable del sistema pol칤tico argentino. Los secretos del Congreso, de @gsued  https://t.co/vTC3kPYH2w  https://t.co/HU1Uua6U03",megustaleerarg,316429650,2019-08-27,10:01:26,85,2,13,['septiembre'],"[{'screen_name': 'gsued', 'name': 'gabriel sued', 'id': '148078014'}]",False,,,,
1166331864459685888,1166331864459685888,"El cambio clim치tico pronto ser치 irreversible. Los pol칤ticos no van a reaccionar. Tal vez vos s칤.  Cambiemos el mundo, de @GretaThunberg  https://t.co/RkB2CHQbuh   #huelgaporelclima  https://t.co/XaNqOKuLpW",megustaleerarg,316429650,2019-08-27,09:49:20,3,0,1,['huelgaporelclima'],"[{'screen_name': 'gretathunberg', 'name': 'greta thunberg', 'id': '1006419421244678144'}]",False,,,,
1166322302197407746,1166322302197407746,游닠 @AgusBazterrica responde el cuestionario:  https://t.co/5tlmCWDdBF    九덢잺 쮺u치l es el primer libro que record치s haber le칤do? 九덢잺 쮸 qu칠 preferir칤as dedicarte en lugar de escribir? 九덢잺 쮺u치l es el libro que m치s has regalado? 九덢잺쯈u칠 escritor vivo admir치s m치s? 九덢잺 쯈u칠 est치s leyendo?  https://t.co/LalRXWFeHF,megustaleerarg,316429650,2019-08-27,09:11:20,4,1,0,[],"[{'screen_name': 'agusbazterrica', 'name': 'agustina bazterrica游눜游낍勇끂u200d游깯', 'id': '409594673'}]",False,,,,
1166314100017848321,1166314100017848321,游늷 @GugaLusto presenta Debajo del agua en la Feria Internacional del Libro de Neuqu칠n    游딉  S치bado 31/08 낋 16:30hs 游늸 Museo Nacional de Bellas Artes  https://t.co/H9vwN7h86X,megustaleerarg,316429650,2019-08-27,08:38:45,0,0,0,[],"[{'screen_name': 'gugalusto', 'name': 'mart칤n lousteau', 'id': '141286250'}]",False,,,,
1166065071447060482,1166065071447060482,"Las 80 pel칤culas favoritas de Quentin Tarantino en Cielo drive, el nuevo libro de @SebaDeCaro:  https://t.co/9GQczYTCmx  https://t.co/YK1At8e0ei",megustaleerarg,316429650,2019-08-26,16:09:12,33,0,3,[],"[{'screen_name': 'sebadecaro', 'name': 'seba de caro', 'id': '29715245'}]",False,,,,
1166049950607859713,1166049950607859713,游늷 @claudiapineiro presenta Qui칠n no en la Feria Internacional del Libro de Neuqu칠n.   游딉  Viernes 30/08 낋 20:30hs 游늸 Museo Nacional de Bellas Artes. Auditorio Irma Cu침a.  https://t.co/L8akw7BPk8,megustaleerarg,316429650,2019-08-26,15:09:07,25,1,4,[],"[{'screen_name': 'claudiapineiro', 'name': 'claudia pi침eiro 游눜', 'id': '128205366'}]",False,,,,
1166047877925343232,1166033114205949953,"Retrato de Truman Capote, un ni침o eterno cruel, talentoso y necesitado de amor en @InfobaeCultura:   https://t.co/urO91FOXo6",megustaleerarg,316429650,2019-08-26,15:00:52,4,0,1,[],"[{'screen_name': 'infobaecultura', 'name': 'infobae cultura', 'id': '1380059125'}]",False,,,,
1166033114205949953,1166033114205949953,"En #SEPTIEMBRE: el estilo inconfundible de Truman Capote -la variedad de registro, la hondura y sutileza psicol칩gica, el humor m치gico e irreverente- es el instrumento perfecto para contar El arpa de hierba, obra clave de su universo literario:  https://t.co/PY3Nyl719T  https://t.co/v3CBNoXbSo",megustaleerarg,316429650,2019-08-26,14:02:12,4,1,0,['septiembre'],[],False,,,,
1166025632196771840,1166025632196771840,游닠 @AgusBazterrica responde el cuestionario:  https://t.co/5tlmCWDdBF    九덢잺 쮺u치l es el primer libro que record치s haber le칤do? 九덢잺 쮸 qu칠 preferir칤as dedicarte en lugar de escribir? 九덢잺 쮺u치l es el libro que m치s has regalado? 九덢잺쯈u칠 escritor vivo admir치s m치s? 九덢잺 쯈u칠 est치s leyendo?  https://t.co/a7sNQCHKyY,megustaleerarg,316429650,2019-08-26,13:32:29,11,0,3,[],"[{'screen_name': 'agusbazterrica', 'name': 'agustina bazterrica游눜游낍勇끂u200d游깯', 'id': '409594673'}]",False,,,,
1165996815247974400,1165996815247974400,"A 120 a침os de su nacimiento, autores, editores y periodistas de de todo el mundo recuerdan historias en com칰n con Jorge Luis Borges #Borges #Borges120a침os  https://t.co/6eSIDDAsR7",megustaleerarg,316429650,2019-08-26,11:37:58,12,0,6,"['borges', 'borges120a침os']",[],False,,,,
1165988848612139009,1165988848612139009,"Un d칤a como hoy pero 1914 nac칤a Julio Cort치zar, uno de los escritores argentinos m치s importantes de todos los tiempos, autor de Rayuela, un libro que conmocion칩 el panorama cultural de su tiempo y marc칩 un hito dentro de la narrativa contempor치nea  https://t.co/vAYzey7UA1  https://t.co/YXoXrFoomx",megustaleerarg,316429650,2019-08-26,11:06:19,187,3,83,[],[],False,,,,
1165971805833707520,1165971805833707520,"A 120 a침os del nacimiento de Jorge Luis Borges sorteamos tres packs con sus libros El Aleph, Historia universal de la infamia y Ficciones.  춰Complet치 la TRIVIA y ya est치s participando! 游녤游낕  https://t.co/dQIE8x5a7Q  https://t.co/hWiD8GKd3q",megustaleerarg,316429650,2019-08-26,09:58:35,17,1,2,[],[],False,,,,
1165953141612961792,1165953141612961792,"Sin importar a qu칠 distancia estemos de la Amazon칤a, todo lo malo que le est치 ocurriendo terminar치 por afectar nuestras vidas. Viaje al fin del Amazonas, de @SilvinaHeguy, una cr칩nica de la lucha por la selva de la que depende la vida en el Planeta:  https://t.co/oE9cu0yUWX  https://t.co/9iEgPzo0v9",megustaleerarg,316429650,2019-08-26,08:44:25,6,0,5,[],"[{'screen_name': 'silvinaheguy', 'name': 'silvina heguy', 'id': '47767686'}]",False,,,,
1165248925458149379,1165248321969098752,Dise침os de @maxrompo de la biblioteca Borges (2016-2019) para el sello Sudamericana:  https://t.co/ECuE1KdpyH  https://t.co/tqUOJgiaLI,megustaleerarg,316429650,2019-08-24,10:06:07,16,0,3,[],"[{'screen_name': 'maxrompo', 'name': 'max rompo', 'id': '397603613'}]",False,,,,
1165248321969098752,1165248321969098752,"Un d칤a como hoy pero de 1899 nac칤a Jorge Luis Borges, considerado uno de los m치s importantes escritores en lengua hispana de la historia de la literatura.  https://t.co/6eSIDDAsR7",megustaleerarg,316429650,2019-08-24,10:03:43,193,5,71,[],[],False,,,,
1164911363438915586,1164911363438915586,游닠@AgusBazterrica responde el cuestionario:  https://t.co/5tlmCWDdBF    九덢잺 쮺u치l es el primer libro que record치s haber le칤do? 九덢잺 쮸 qu칠 preferir칤as dedicarte en lugar de escribir? 九덢잺 쮺u치l es el libro que m치s has regalado? 九덢잺쯈u칠 escritor vivo admir치s m치s? 九덢잺 쯈u칠 est치s leyendo?  https://t.co/GIrm3fSNGB,megustaleerarg,316429650,2019-08-23,11:44:46,6,0,2,[],"[{'screen_name': 'agusbazterrica', 'name': 'agustina bazterrica游눜游낍勇끂u200d游깯', 'id': '409594673'}]",False,,,,
1164885846882996224,1164885846882996224,"Ma침ana se cumplen 120 a침os del nacimiento de Jorge Luis Borges y sorteamos tres packs con sus libros El Aleph, Historia universal de la infamia y Ficciones.  춰Complet치 la TRIVIA y ya est치s participando! 游녤游낕  https://t.co/dQIE8x5a7Q  https://t.co/QUQc3vRUKh",megustaleerarg,316429650,2019-08-23,10:03:23,9,1,2,[],[],False,,,,
1164525958503784451,1164525958503784451,"Elena sabe, de @claudiapineiro. Una novela 칤ntima y cr칤tica donde el cuerpo femenino es el verdadero protagonista. Este mes en su edici칩n de bolsillo en todas las librer칤as del pa칤s:  https://t.co/AkVS0w2F0d  https://t.co/fZNhBj43Dr",megustaleerarg,316429650,2019-08-22,10:13:19,17,0,3,[],"[{'screen_name': 'claudiapineiro', 'name': 'claudia pi침eiro 游눜', 'id': '128205366'}]",False,,,,
1164508418834599937,1164508418834599937,"Sin importar a qu칠 distancia estemos de la Amazon칤a, todo lo malo que le est치 ocurriendo terminar치 por afectar nuestras vidas. Viaje al fin del Amazonas, de @SilvinaHeguy, una cr칩nica de la lucha por la selva de la que depende la vida en el Planeta:  https://t.co/oE9cu0yUWX  https://t.co/YL7y6QwmmG",megustaleerarg,316429650,2019-08-22,09:03:37,17,1,5,[],"[{'screen_name': 'silvinaheguy', 'name': 'silvina heguy', 'id': '47767686'}]",False,,,,
1164170417826869248,1164170417826869248,"En #SEPTIEMBRE: 쯏 d칩nde est치 la gente? Campa침as y encuestas en la sociedad del presente extremo, de Jaime Dur치n Barba y Santiago Nieto. Un libro de lectura imprescindible para entender c칩mo circula hoy la opini칩n p칰blica en materia pol칤tica:  https://t.co/wWZjRm2qcb  https://t.co/tFKKv57NZt",megustaleerarg,316429650,2019-08-21,10:40:31,3,0,2,['septiembre'],[],False,,,,
1164160843170402304,1164160843170402304,"Eduardo Sacheri en @LANACION: ""Llevar un libro al cine es un trabajo dur칤simo""  https://t.co/X3Fz8bLjVn  https://t.co/YbXtHjXkOi",megustaleerarg,316429650,2019-08-21,10:02:28,16,0,1,[],"[{'screen_name': 'lanacion', 'name': 'la nacion', 'id': '33989170'}]",False,,,,
1164148808294567937,1164148312825585666,"@maxrompo Este mes en librer칤as: Los pichiciegos, su obra maestra y una de las emblem치ticas sobre la Guerra de Malvinas:  https://t.co/hxWI3iyJeW  https://t.co/JnTPIg4YJN",megustaleerarg,316429650,2019-08-21,09:14:39,0,0,0,[],[],False,,,,
1164148312825585666,1164148312825585666,"Un d칤a como hoy pero del a침o 2010, mor칤a Rodolfo Fogwill, uno de los escritores m치s irreverentes de la literatura argentina de los 칰ltimos cuarenta a침os:  https://t.co/v8ocoa0CMg (Dise침o: @maxrompo)  https://t.co/4PDVc3Usz6",megustaleerarg,316429650,2019-08-21,09:12:41,6,1,2,[],"[{'screen_name': 'maxrompo', 'name': 'max rompo', 'id': '397603613'}]",False,,,,
1163847942077341702,1163847942077341702,"Banco a la sombra, de Mar칤a Moreno, en @pagina12:  https://t.co/hCbo7Sb9NU  https://t.co/dw9s0DScTu",megustaleerarg,316429650,2019-08-20,13:19:07,0,0,0,[],"[{'screen_name': 'pagina12', 'name': 'p치gina|12', 'id': '775474080715767808'}]",False,,,,
1163828134124408833,1163828134124408833,游늷 Presentaci칩n tem치tica de Camisetas legendarias del f칰tbol argentino: la historia de la banda roja desde adentro.  游딉  S치bado 24/08 낋 18:30hs 游늸 Museo River. Av. Figueroa Alcorta 7509  https://t.co/ciMrL1tKPU,megustaleerarg,316429650,2019-08-20,12:00:24,13,0,9,[],[],False,,,,
1163814827988377600,1163814827988377600,"游닠 @eduardosacheri cuenta de qu칠 se trata La noche de la usina, la novela ganadora del Premio Alfaguara 2016, sobre la que se bas칩 La odisea de los giles:  https://t.co/l8jGiHGwjx  https://t.co/usYlaxAsJD",megustaleerarg,316429650,2019-08-20,11:07:32,13,0,3,[],"[{'screen_name': 'eduardosacheri', 'name': 'eduardo sacheri', 'id': '278231789'}]",False,,,,
1163810256276746240,1163810256276746240,"Lindsey Fitzharris, autora de De matasanos a cirujanos, rescata del olvido a un gran h칠roe moderno: el cirujano brit치nico Joseph Lister, quien cambi칩 la medicina para siempre al introducir las t칠cnicas antis칠pticas:  https://t.co/yROdFmqx4i  https://t.co/E8123ky35T",megustaleerarg,316429650,2019-08-20,10:49:22,5,0,4,[],[],False,,,,
1163782815030370304,1163782815030370304,"Los secretos de los ministros de Econom칤a, de @lilianafranco20. Las mejores an칠cdotas que desde el regreso de la democracia esconden las paredes y pasillos del Palacio de Hacienda:  https://t.co/Jr21KIdgJI  https://t.co/zTknbjyDYS",megustaleerarg,316429650,2019-08-20,09:00:19,0,0,0,[],"[{'screen_name': 'lilianafranco20', 'name': 'liliana franco,', 'id': '160271681'}]",False,,,,
1162429900613177350,1162429900613177350,"游늷 Jaime Bayly firma ejemplares de su 칰ltimo libro, Pecho fr칤o.  游딉  Hoy viernes 16/09 낋 18hs 游늸 Hotel Alvear Palace, Sal칩n Diplom치tico. Av. Alvear 1891.  https://t.co/t89N9gPXtf",megustaleerarg,316429650,2019-08-16,15:24:19,0,0,0,[],[],False,,,,
1162060864708653057,1162060864708653057,游닡 @sebacampanario  cuenta de qu칠 modo los +45 tendr치n un lugar protag칩nico en los pr칩ximos a침os. Una propuesta original y disruptiva en Revoluci칩n Senior. Esta semana en nuestro podcast No ficci칩n:  https://t.co/Vj3Clj2n7s,megustaleerarg,316429650,2019-08-15,14:57:54,7,0,2,[],"[{'screen_name': 'sebacampanario', 'name': 'sebasti치n campanario', 'id': '171196248'}]",False,,,,
1162024325836345344,1162024325836345344,游닠 @eduardosacheri y Sebasti치n Boresztein en la @ferialibro de este a침o dialogando sobre la adaptaci칩n de La noche de la usina que se estrena hoy en La odisea de los giles con la participaci칩n de @bombitadarin  https://t.co/VHGfCtDnJd,megustaleerarg,316429650,2019-08-15,12:32:43,15,0,0,[],"[{'screen_name': 'eduardosacheri', 'name': 'eduardo sacheri', 'id': '278231789'}, {'screen_name': 'ferialibro', 'name': 'feria del libro', 'id': '90878064'}, {'screen_name': 'bombitadarin', 'name': 'ricardo darin', 'id': '2841576191'}]",False,,,,
1161642238700597248,1161642238700597248,Daniel Guebel responde nuestro cuestionario:   https://t.co/wRvEp9jDbT  九덢잺 쮺u치l es el primer libro que record치s haber le칤do? 九덢잺 쮸 qu칠 preferir칤as dedicarte en lugar de escribir? 九덢잺 쮺u치l es el libro que m치s has regalado? 九덢잺쯈u칠 escritor vivo admir치s m치s? 九덢잺 쯈u칠 est치s leyendo?  https://t.co/JuGyQ0fbjY,megustaleerarg,316429650,2019-08-14,11:14:26,1,0,0,[],[],False,,,,
1161337285603921922,1160956910570496000,AHORA en VIVO desde Facebook  https://t.co/D5GXabxKaB,megustaleerarg,316429650,2019-08-13,15:02:40,2,0,0,[],[],False,,,,
1161318608192122880,1161318608192122880,"游늷 Presentaci칩n de Playa de barro, de Silvia L칩pez, Un policial novedoso cuyo enigma es la desaparici칩n del hijo de una pareja que acaba de separarse.   游딉   Viernes 06/09 낋 19hs 游늸 @eternacadencia, Honduras 5574.  https://t.co/1qLm6Xq4kN",megustaleerarg,316429650,2019-08-13,13:48:27,4,0,0,[],"[{'screen_name': 'eternacadencia', 'name': 'eterna cadencia', 'id': '34765906'}]",False,,,,
1160956910570496000,1160956910570496000,"游닠 @bilinkis, autor de Gu칤a para sobrevivir al presente, en en 游댮VIVO en los estudios de Facebook: ma침ana a las 15 desde las fanpages de Me gusta leer Argentina y Santiago Bilinkis:   https://t.co/0AV458PxK4  https://t.co/qUvP4q1gA2",megustaleerarg,316429650,2019-08-12,13:51:11,13,1,4,[],"[{'screen_name': 'bilinkis', 'name': 'santiago bilinkis', 'id': '14048809'}]",False,,,,
