id,conversation_id,tweet,username,user_id,date,time,likes_count,replies_count,retweets_count,hashtags,mentions,retweet,quote_url,user_rt_id,source,retweet_date
1230580551876304897,1230580551876304897,游냠 En el #DiaInternacionalDelGato una selecci칩n de m치s de 10 libros para saber por qu칠 los gatos hacen lo que hacen y entender a este animal fascinante:  https://t.co/x5ofAaXOwD  https://t.co/U00zZboo63,megustaleerarg,316429650,2020-02-20,16:50:41,5,0,1,['diainternacionaldelgato'],[],False,,,,
1230576442678923270,1230576442678923270,游녢,megustaleerarg,316429650,2020-02-20,16:34:21,15,0,2,[],[],False,https://twitter.com/martinhadis/status/1230561074744709126,,,
1230203045180575746,1230202783544086528,"@capitanintriga En Los Oesterheld, Fernanda Nicolini y Alicia Beltrami cuenta por primera vez la historia de la familia del creador del Eternauta, aniquilada por la dictadura que secuestr칩 y asesin칩 a H칠ctor, sus cuatro hijas, sus maridos y desapareci칩 a sus nietos:  https://t.co/uvcYIuJJjF  https://t.co/ZNB7efSkLL",megustaleerarg,316429650,2020-02-19,15:50:36,4,0,1,[],[],False,,,,
1230202783544086528,1230202783544086528,"Netflix confirm칩 que trabajar치 en una serie basada en El Eternauta, de H칠ctor Oesterheld (foto de @capitanintriga)  https://t.co/vyzjGwi47X",megustaleerarg,316429650,2020-02-19,15:49:34,12,1,5,[],"[{'screen_name': 'capitanintriga', 'name': 'tom치s balmaceda', 'id': '2340581'}]",False,,,,
1230140455293214722,1230140455293214722,"Rese침a de Nuevo cuentos malvados, de @MargaretAtwood, en @perfildiario:  https://t.co/e5LKboqMva  https://t.co/hbtvudDw8P",megustaleerarg,316429650,2020-02-19,11:41:54,2,0,0,[],"[{'screen_name': 'margaretatwood', 'name': 'margaret e. atwood', 'id': '54730258'}, {'screen_name': 'perfildiario', 'name': 'diario perfil', 'id': '175881965'}]",False,,,,
1229763671334825985,1229763671334825985,"En #MARZO: a 10 a침os de la muerte de Tom치s Eloy Mart칤nez El cantor de tango, la novela con m치s traducciones en todo el mundo despu칠s de Santa Evita,  vuelve a las librer칤as:  https://t.co/gdl3VNFhDr  https://t.co/z0P2VfM4Ou",megustaleerarg,316429650,2020-02-18,10:44:41,3,0,0,['marzo'],[],False,,,,
1229416594176139271,1229416594176139271,"57 a침os de su muerte, tres libros de Sylvia Plath en todas las librer칤as del pa칤s:  https://t.co/2YfsQEzFI7 (recuadro en @pagina12)  https://t.co/WMOXzUDQxP",megustaleerarg,316429650,2020-02-17,11:45:32,4,1,1,[],"[{'screen_name': 'pagina12', 'name': 'p치gina|12', 'id': '775474080715767808'}]",False,,,,
1229379949842305025,1229379949842305025,"Lideran rankings de venta, se consolidan autoras nacionales y nacen nuevas colecciones: el boom de la novela rom치ntica en Revista VIVA  https://t.co/G8RdQFXCLx  https://t.co/QRldicuT14",megustaleerarg,316429650,2020-02-17,09:19:55,28,0,8,[],[],False,,,,
1228377513610612736,1228377513610612736,Un viaje por los rincones m치s profundos de los sentimientos y del erotismo; una historia de amor y misterio que te atrapa hasta la 칰ltima p치gina o una novela epistolar que cuenta la apasionante historia de amor de dos youtubers. Un libro para cada amor:  https://t.co/DWY8VXuHrO  https://t.co/GMZCI489f7,megustaleerarg,316429650,2020-02-14,14:56:36,4,0,2,[],[],False,,,,
1228355630521556992,1228355630521556992,"游꿚 Todo lo que necesit치s hoy es AudioLove: prob치 un audiolibro, esc칰chalo junto a la persona que am치s y enamorate para siempre de esta nueva forma de leer   https://t.co/ThzSlvyQzy  https://t.co/lJhcKv6IWE",megustaleerarg,316429650,2020-02-14,13:29:38,2,0,0,[],[],False,,,,
1228042342197866497,1228042342197866497,"Rese침a en @revistaenie: 쯉e puede vencer a la muerte? El juez de la Corte Horacio Rosatti escribi칩 un ensayo que indaga en distintas formas de morir, la inmortalidad, la vejez y el deseo de trascender:  https://t.co/0DuJHEBrRf  https://t.co/GtMsUfUuFK",megustaleerarg,316429650,2020-02-13,16:44:44,3,0,0,[],"[{'screen_name': 'revistaenie', 'name': 'revista 침', 'id': '20455887'}]",False,,,,
1228002052149850112,1228002052149850112,游닠 @claudiapineiro responde nuestro cuestionario:  https://t.co/6p2aPIALN4  쮺u치l es el primer libro que record치s haber le칤do? 쮸 qu칠 preferir칤as dedicarte en lugar de escribir? 쮺u치l es el libro que m치s has regalado? 쯈u칠 escritor vivo admir치s m치s? 쯈u칠 libro est치s leyendo ahora?  https://t.co/e9P8Qh1OP5,megustaleerarg,316429650,2020-02-13,14:04:39,15,3,3,[],"[{'screen_name': 'claudiapineiro', 'name': 'claudia pi침eiro 游눜', 'id': '128205366'}]",False,,,,
1227643384183083008,1227643384183083008,"Un d칤a como hoy pero de 1984 mor칤a Julio Cort치zar, uno de los escritores argentinos m치s importantes de todos los tiempos:  https://t.co/X80xRtt1vC  https://t.co/13cAC0UwC8",megustaleerarg,316429650,2020-02-12,14:19:25,11,0,1,[],[],False,,,,
1227317261314117634,1227317261314117634,"Lumen celebra sus 60 a침os, y su fundadora, Esther Tusquets, vuelve para contar la historia del sello:   https://t.co/52dgINxVUS  https://t.co/9K1gEs9xeZ",megustaleerarg,316429650,2020-02-11,16:43:32,3,0,1,[],[],False,,,,
1227235450852499456,1227216697335144448,"Con su inigualable toque de humor y melancol칤a, Berlin se hace eco de su vida, asombrosa y convulsa, para crear verdaderos milagros literarios con episodios del d칤a a d칤a en Manual para mujeres de la limpieza:   https://t.co/Kg3pkEL5LB  https://t.co/Lf6VKr3HcG",megustaleerarg,316429650,2020-02-11,11:18:27,1,0,0,[],[],False,,,,
1227216697335144448,1227216697335144448,"Pedro Almod칩var adaptar치 Manual para mujeres de la limpieza, de Luc칤a Berlin, para su primera pel칤cula en ingl칠s:  https://t.co/VlIFwdrQJr  https://t.co/82JfkfpJbP",megustaleerarg,316429650,2020-02-11,10:03:55,28,2,5,[],[],False,,,,
1226957797763567616,1226957797763567616,쯈u칠 hacen los escritores cuando no escriben? 쮸 qu칠 dedican su tiempo de ocio? 쮼n qu칠 momento interrumpen su espacio de creaci칩n para disfrutar de otra actividad? 쯊iene otros oficios?  Primer episodio de Alter Ego con Kike Ferrari:  https://t.co/rFgq5C2BZW  https://t.co/d374EiUj2g,megustaleerarg,316429650,2020-02-10,16:55:09,4,0,1,[],[],False,,,,
1226922603564195841,1226922603564195841,"Rodrigo Fres치n y un viaje al fin de la memoria: el escritor argentino, radicado hace a침os en Barcelona, cierra su ambiciosa trilog칤a con La parte recordada. Rese침a en @revistaenie  https://t.co/15O7vcNAkb  https://t.co/4qXxf4zooI",megustaleerarg,316429650,2020-02-10,14:35:18,0,0,0,[],"[{'screen_name': 'revistaenie', 'name': 'revista 침', 'id': '20455887'}]",False,,,,
1226858942539718661,1226858942539718661,Historias que sirvieron de inspiraci칩n en las pel칤culas nominadas a los #PremiosOscars en @LNRevista.  https://t.co/eMixOnKqGA,megustaleerarg,316429650,2020-02-10,10:22:20,4,0,2,['premiososcars'],"[{'screen_name': 'lnrevista', 'name': 'la nacion revista', 'id': '181006101'}]",False,,,,
1226853189158342657,1226853189158342657,"En este breve pero fascinante libro, @KMFollett describe las emociones que sinti칩 cuando conoci칩 la tragedia que amenazaba con destruir Notre-Dame de Par칤s   https://t.co/Wi98DzUm94  https://t.co/aI5xAQ9lcF",megustaleerarg,316429650,2020-02-10,09:59:28,4,0,2,[],"[{'screen_name': 'kmfollett', 'name': 'ken follett', 'id': '160864441'}]",False,,,,
1226846786540769280,1226846786540769280,"Mariana Enriquez sobre Mary Ventura y el noveno reino, cuento in칠dito de Sylvia Plath:  https://t.co/8epXliUKzD En #FEBRERO en librer칤as  https://t.co/bT5CPGTkxD",megustaleerarg,316429650,2020-02-10,09:34:02,2,0,0,['febrero'],[],False,,,,
1226844509834743811,1226844509834743811,"Mujercitas, la adaptaci칩n del cl치sico de Louisa May Alcott y Los dos Papas, el libro de Antony Mccarten sobre Benedicto XVI y Francisco: las pel칤culas nominadas a los #PremiosOscar que se basaron en libros:   https://t.co/2oSzxCzqmv  https://t.co/JATtMsB0o7",megustaleerarg,316429650,2020-02-10,09:24:59,3,0,0,['premiososcar'],[],False,,,,
1225836784656973825,1225836784656973825,游닠 @claudiapineiro responde nuestro cuestionario:  https://t.co/6p2aPIALN4  쮺u치l es el primer libro que record치s haber le칤do? 쮸 qu칠 preferir칤as dedicarte en lugar de escribir? 쮺u치l es el libro que m치s has regalado? 쯈u칠 escritor vivo admir치s m치s? 쯈u칠 libro est치s leyendo ahora?  https://t.co/WlHs9IYqh6,megustaleerarg,316429650,2020-02-07,14:40:39,19,5,1,[],"[{'screen_name': 'claudiapineiro', 'name': 'claudia pi침eiro 游눜', 'id': '128205366'}]",False,,,,
1225824984892833794,1225824984892833794,La adaptaci칩n del cl치sico de Louisa May Alcott y el libro de Antony Mccarten sobre Benedicto XVI y Francisco entre las pel칤culas nominadas a los #PremiosOscar que est치n basadas en libros:   https://t.co/2oSzxCzqmv  https://t.co/h4SGjJdh6p,megustaleerarg,316429650,2020-02-07,13:53:45,4,0,1,['premiososcar'],[],False,,,,
1225471337730379781,1225471337730379781,Tapa de la nueva novela de @claudiapineiro. En marzo en todas las librer칤as del pa칤s.,megustaleerarg,316429650,2020-02-06,14:28:29,11,0,2,[],"[{'screen_name': 'claudiapineiro', 'name': 'claudia pi침eiro 游눜', 'id': '128205366'}]",False,https://twitter.com/claudiapineiro/status/1225462524033761280,,,
1225467246849511426,1225467246849511426,Twitter Party de @Salamandra_Ed 游븿꽥뗵勇游븿꽥勇游븿#HarryPotterBookNight2020,megustaleerarg,316429650,2020-02-06,14:12:14,9,0,1,['harrypotterbooknight2020'],"[{'screen_name': 'salamandra_ed', 'name': 'ediciones salamandra', 'id': '2173985875'}]",False,https://twitter.com/salamandra_ed/status/1225366020753199105,,,
1225457642061074432,1225457642061074432,"Publicado por primera vez en 1981, La cifra, volumen de poes칤a en el que aparecen desplegados el genio y la imaginaci칩n del Borges maduro y reflexivo que ha alcanzado fama mundial, incluye, entre otros, los c칠lebres ""La fama"" y ""Nostalgia del presente""   https://t.co/LpshDFebm2  https://t.co/591yC3B7dp",megustaleerarg,316429650,2020-02-06,13:34:04,2,0,1,[],[],False,,,,
1225452141936041984,1225452141936041984,"A dos a침os de la muerte de Liliana Bodoc, autora de Los d칤as del Venado, una selecci칩n de sus mejores libros:   https://t.co/tv1tVnqLfG  https://t.co/QCPADFYnGc",megustaleerarg,316429650,2020-02-06,13:12:13,23,0,8,[],[],False,,,,
1225427478157676544,1225427478157676544,La adaptaci칩n del cl치sico de Louisa May Alcott y el libro de Antony Mccarten sobre Benedicto XVI y Francisco entre las pel칤culas nominadas a los #PremiosOscar que est치n basadas en libros:   https://t.co/2oSzxCzqmv  https://t.co/647Oz5pT5H,megustaleerarg,316429650,2020-02-06,11:34:12,0,0,0,['premiososcar'],[],False,,,,
1225085856832196609,1225085856832196609,"A cuatro a침os de la muerte de Lohana Berkins, una biograf칤a inigualable de una pionera la lucha por los derechos de las personas trans en la Argentina y Latinoam칠rica escrita por Josefina Fern치ndez. En #MARZO en librer칤as.  https://t.co/8olKAW5VBh",megustaleerarg,316429650,2020-02-05,12:56:43,45,1,13,['marzo'],[],False,,,,
1225056732432474118,1225056732432474118,"Guillermo Arriaga, ganador del Premio Alfaguara 2020, habla de Salvar el fuego con @reinoso en @CulturaClarin: ""Las buenas intenciones son el veneno de la literatura""  https://t.co/ROXN6WeZUD  https://t.co/uBktihWc5T",megustaleerarg,316429650,2020-02-05,11:01:00,23,0,7,[],"[{'screen_name': 'reinoso', 'name': 'gelin reynoso', 'id': '1472522965'}, {'screen_name': 'culturaclarin', 'name': 'clar칤n cultura', 'id': '1205592194'}]",False,,,,
1225035650107420672,1225035650107420672,游닠 @claudiapineiro responde nuestro cuestionario:  https://t.co/6p2aPIALN4  쮺u치l es el primer libro que record치s haber le칤do? 쮸 qu칠 preferir칤as dedicarte en lugar de escribir? 쮺u치l es el libro que m치s has regalado? 쯈u칠 escritor vivo admir치s m치s? 쯈u칠 libro est치s leyendo ahora?  https://t.co/2uQblY2b87,megustaleerarg,316429650,2020-02-05,09:37:13,14,0,5,[],"[{'screen_name': 'claudiapineiro', 'name': 'claudia pi침eiro 游눜', 'id': '128205366'}]",False,,,,
1224690825558401024,1224690825558401024,쯈u칠 hacen los escritores cuando no escriben? 쮸 qu칠 dedican su tiempo de ocio? 쮼n qu칠 momento interrumpen su espacio de creaci칩n para disfrutar de otra actividad? 쯊iene otros oficios?  Primer episodio de Alter Ego con Kike Ferrari:  https://t.co/rFgq5C2BZW  https://t.co/nZFKd8VgMQ,megustaleerarg,316429650,2020-02-04,10:47:01,8,0,2,[],[],False,,,,
1224671009485328387,1224671009485328387,En #FEBRERO: @StephenKing vuelve a Castle Rock con un mensaje para nuestros tiempos. Elevaci칩n es una historia fascinante y conmovedora y un ant칤doto contra nuestra cultura individualista:  https://t.co/7iCh95nT4N  https://t.co/IUHDIOzJAP,megustaleerarg,316429650,2020-02-04,09:28:16,19,0,2,['febrero'],"[{'screen_name': 'stephenking', 'name': 'stephen king', 'id': '2233154425'}]",False,,,,
1224430039565053953,1224430039565053953,"La loba. Cuatro hermanas entre el amor y el odio, el nuevo libro de @CamuchaEscobar:  https://t.co/qhyMuAszmJ En todas las librer칤as del pa칤s.  https://t.co/VDPOIasQR3",megustaleerarg,316429650,2020-02-03,17:30:44,7,2,2,[],"[{'screen_name': 'camuchaescobar', 'name': 'camucha escobar', 'id': '4495285408'}]",False,,,,
1224389375246635008,1224389375246635008,"Rese침a de Vuelta y vuelta de Iosi Havilio, por Mauro Libertella en @revistaenie:  https://t.co/gomgA7MIvu  https://t.co/hv1SXZpb8Z",megustaleerarg,316429650,2020-02-03,14:49:09,0,0,0,[],"[{'screen_name': 'revistaenie', 'name': 'revista 침', 'id': '20455887'}]",False,,,,
1224344690079694851,1224344690079694851,"Camilleri, un mundo criminal m치s all치 de Montalbano: perfil del prol칤fico autor italiano que construy칩 un universo ajeno al de su gran personaje, una obra en la que el 'thriller' y la cr칩nica se complementan para dar una visi칩n cruda de Italia:  https://t.co/yOFaLOc1iM  https://t.co/md5rYGStbv",megustaleerarg,316429650,2020-02-03,11:51:35,3,1,1,[],[],False,,,,
1224314453434478593,1224314453434478593,"Rese침a de El planeta inh칩spito, de David Wallace-Wells, en @IdeasLN: miradas hacia un planeta en transformaci칩n  https://t.co/jsxSv4iLE4  https://t.co/VgBTwO3hoz",megustaleerarg,316429650,2020-02-03,09:51:27,2,0,2,[],"[{'screen_name': 'ideasln', 'name': 'la nacion ideas', 'id': '123648741'}]",False,,,,
1224304963855298560,1224304963855298560,"Evelina Cabrera, autora de Alta negra, en @perfildiario: ""Sigue habiendo machismo en el f칰tbol""  https://t.co/nfHuMWasDb  https://t.co/LRiyCO0r9F",megustaleerarg,316429650,2020-02-03,09:13:44,1,0,0,[],"[{'screen_name': 'perfildiario', 'name': 'diario perfil', 'id': '175881965'}]",False,,,,
1223629009185099777,1223629009185099777,"Un d칤a como hoy pero hace 90 a침os nac칤a Mar칤a Elena Walsh, poeta, novelista, cantante, compositora, guionista de teatro, cine y televisi칩n, una figura esencial de la cultura argentina.  https://t.co/oFqyg0BbuD",megustaleerarg,316429650,2020-02-01,12:27:44,60,0,23,[],[],False,,,,
1223295758616670211,1223295758616670211,游눪游닄춰Nuestras novedades editoriales de #FEBRERO!    https://t.co/D1pBkMMBIj  https://t.co/s3AZTJVLAA,megustaleerarg,316429650,2020-01-31,14:23:31,13,0,3,['febrero'],[],False,,,,
1223288478194114560,1223288478194114560,El nuevo libro de Leo Oyola con una historia de zombies que habitan una c치rcel de mujeres; el imperdible libro de cuentos de @AgusBazterrica y la esperada novela de @olguinserg con la periodista Ver칩nica Rosenthal entre los libros m치s esperados de 2020:   https://t.co/uaW1NX9jbc  https://t.co/VnYPqOohT3,megustaleerarg,316429650,2020-01-31,13:54:35,22,0,9,[],"[{'screen_name': 'agusbazterrica', 'name': 'agustina bazterrica游눜游낍勇끂u200d游깯', 'id': '409594673'}, {'screen_name': 'olguinserg', 'name': 'sergio olguin', 'id': '388635402'}]",False,,,,
1223275317390913539,1223229435211657219,"Entrevista de archivo con Pacho O췂Donnell: ""Los momentos de alegr칤a, felicidad o plenitud los encuentro en la escritura"".  https://t.co/baAkJzGMu2",megustaleerarg,316429650,2020-01-31,13:02:17,3,0,1,[],[],False,,,,
1223229435211657219,1223229435211657219,"A 10 a침os de la muerte de Tom치s Eloy Mart칤nez, autor de dos novelas cl치sicas de la literatura argentina (La novela de Per칩n y Santa Evita), una selecci칩n de sus mejores libros:  https://t.co/bQJBntuRg1  https://t.co/Fko0inWqZD",megustaleerarg,316429650,2020-01-31,09:59:58,5,1,1,[],[],False,,,,
1222944298238402560,1222944298238402560,쯈u칠 hacen los escritores cuando no escriben? 쮸 qu칠 dedican su tiempo de ocio? 쮼n qu칠 momento interrumpen su espacio de creaci칩n para disfrutar de otra actividad? 쯊iene otros oficios?  Primer episodio de Alter Ego con Kike Ferrari:  https://t.co/rFgq5C2BZW  https://t.co/06ZSfMqJIR,megustaleerarg,316429650,2020-01-30,15:06:56,2,0,0,[],[],False,,,,
1222494727129518080,1222494727129518080,"La tapa de la nueva edici칩n de Distancia de rescate, la premiada novela de @sschweblin, llevada al cine por Claudia Llosa:  https://t.co/II5HPDiiYw En todas las librer칤as del pa칤s. Dise침o: @maxrompo  https://t.co/CS7opR0swH",megustaleerarg,316429650,2020-01-29,09:20:30,19,0,5,[],"[{'screen_name': 'sschweblin', 'name': 'samanta schweblin', 'id': '1478259620'}, {'screen_name': 'maxrompo', 'name': 'max rompo', 'id': '397603613'}]",False,,,,
1222488249702191105,1222488249702191105,"Entrevista a Michael Ondaatje, el autor de El paciente ingl칠s, sobre su nueva novela Luz de guerra, en Radar:  https://t.co/r3MihUfEBi  https://t.co/EKM9fXItaf",megustaleerarg,316429650,2020-01-29,08:54:46,0,0,0,[],[],False,,,,
1222245294370426880,1222245294370426880,"En #FEBRERO: Andrea Camilleri, el maestro de la novela negra, escribe una carta a su bisnieta Matilda. En ella repasa los episodios m치s representativos de su trayectoria personal y profesional junto con los hechos hist칩ricos m치s notables del 칰ltimo siglo:  https://t.co/yV0YCIh75p  https://t.co/ratS3qpdZ0",megustaleerarg,316429650,2020-01-28,16:49:21,2,0,1,['febrero'],[],False,,,,
1222238057514127360,1222238057514127360,쯈u칠 hacen los escritores cuando no escriben? 쮸 qu칠 dedican su tiempo de ocio? 쮼n qu칠 momento interrumpen su espacio de creaci칩n para disfrutar de otra actividad? 쯊iene otros oficios?  Primer episodio de Alter Ego con Kike Ferrari:  https://t.co/rFgq5C2BZW  https://t.co/MUCUQyop4c,megustaleerarg,316429650,2020-01-28,16:20:35,2,0,1,[],[],False,,,,
1222234260746260481,1222234260746260481,"游늷Homenaje sinf칩nico a Mar칤a Elena Walsh: Cantando al sol. 游딉  S치bado 01/02 낋 20hs 游닄 Direcci칩n y arreglos: Gustavo ""Popi"" Spatocco  游늸 Auditorio nacional. Centro Cultural Kirchner.  Sarmiento 151.  https://t.co/SOZHiH0faw",megustaleerarg,316429650,2020-01-28,16:05:30,7,0,2,[],[],False,,,,
1222212872777977856,1222212872777977856,"Mario Levrero naci칩 en Montevideo en 1940 y falleci칩 en la misma ciudad en 2004. Autor, entre otros t칤tulos, de La novela luminosa y El discurso vac칤o, lo recordamos a 80 a침os de su nacimiento con una selecci칩n de sus mejores libros:  https://t.co/RcJPoEtxYS Dise침o: @maxrompo.  https://t.co/4UaHrfds8V",megustaleerarg,316429650,2020-01-28,14:40:31,18,0,5,[],"[{'screen_name': 'maxrompo', 'name': 'max rompo', 'id': '397603613'}]",False,,,,
1222187775799197697,1222187775799197697,"Un d칤a como hoy pero de 1813 Jane Austen publica an칩nimamente Orgullo y prejuicio, considerada una de las obras maestras de la literatura inglesa de todos los tiempos:   https://t.co/fhgbnZpNED  https://t.co/ShcEyEaSry",megustaleerarg,316429650,2020-01-28,13:00:47,50,3,11,[],[],False,,,,
1222143284321116161,1222143284321116161,"Se cumplen 43 a침os de la publicaci칩n de El resplandor, la tercera novela de @StephenKing y su primer best seller:  https://t.co/cZMeRQaEQN  https://t.co/H9bpO31Dg0",megustaleerarg,316429650,2020-01-28,10:03:59,25,0,5,[],"[{'screen_name': 'stephenking', 'name': 'stephen king', 'id': '2233154425'}]",False,,,,
1222126930176159744,1222126930176159744,"A dos d칤as del estreno de Mujercitas en el cine, la nueva versi칩n de un cl치sico de la literatura, por @lorusso10 en @noticiasrevista.  https://t.co/qqS9qQEmzB",megustaleerarg,316429650,2020-01-28,08:59:00,7,0,1,[],"[{'screen_name': 'lorusso10', 'name': 'adriana lorusso', 'id': '46373126'}, {'screen_name': 'noticiasrevista', 'name': 'revista noticias', 'id': '237562389'}]",False,,,,
1221870972149620743,1221870972149620743,A침o nuevo chino: las predicciones de Ludovica Squirru Dari  https://t.co/D0bQcmZ9EV  https://t.co/lc3XHYZvsn,megustaleerarg,316429650,2020-01-27,16:01:55,2,0,0,[],[],False,,,,
1221833497037410306,1221833497037410306,游꺖游끴勇游띑勇 쯈uer칠s ganar dos noches en Viejo Hotel Ostende? Particip치 de este sorteo espectacular para el 29 de febrero y el 1 de marzo. 춰Complet치 tus datos y ya est치s participando! 游녤  https://t.co/LH2vTQzlXU  https://t.co/YyZT61uZB5,megustaleerarg,316429650,2020-01-27,13:33:00,5,0,2,[],[],False,,,,
1221829939105869824,1221829939105869824,"Mariano del Mazo, autor de Entre lujurias y represi칩n, con Reynaldo @Sietecase en @radioconvos899.",megustaleerarg,316429650,2020-01-27,13:18:52,2,0,0,[],"[{'screen_name': 'sietecase', 'name': 'reynaldo sietecase', 'id': '190037399'}, {'screen_name': 'radioconvos899', 'name': 'radio con vos 89.9', 'id': '3065748729'}]",False,https://twitter.com/radioconvos899/status/1221815518161788933,,,
1221826599793893376,1221826599793893376,"游닠 A prop칩sito del Premio Goya para La osidea de los giles, un extracto de la chrla de @eduardosacheri y Sebasti치n Boresztein en la @ferialibro  sobre la adaptaci칩n de La noche de la usina en mayo de 2019.  https://t.co/VHGfCtDnJd",megustaleerarg,316429650,2020-01-27,13:05:36,29,2,10,[],"[{'screen_name': 'eduardosacheri', 'name': 'eduardo sacheri', 'id': '278231789'}, {'screen_name': 'ferialibro', 'name': 'feria del libro', 'id': '90878064'}]",False,,,,
1221766521367736321,1221766521367736321,Seis escritoras revelan qu칠 signific칩 para ellas descubrir el universo de 'Mujercitas' y el viaje de @GloriaVCasanas tras los pasos de Louisa May Alcott:  https://t.co/IR33ym8aUw  https://t.co/pvzsxEe3Kx,megustaleerarg,316429650,2020-01-27,09:06:52,9,0,3,[],"[{'screen_name': 'gloriavcasanas', 'name': 'gloria v. casa침as', 'id': '511839646'}]",False,,,,
1221762483465179136,1221762483465179136,"Variaciones Enigma, de @aaciman y las distintas formas del amor:  https://t.co/QEPF4d4uog Por @dangigena1  https://t.co/DujIkttUkI",megustaleerarg,316429650,2020-01-27,08:50:49,1,0,1,[],"[{'screen_name': 'aaciman', 'name': 'andr칠 aciman', 'id': '39028976'}, {'screen_name': 'dangigena1', 'name': 'daniel gigena', 'id': '3555685097'}]",False,,,,
1221414902369345537,1221414902369345537,"춰Felicitaciones @eduardosacheri! La odisea de los giles, pel칤cula basada en su novela La noche de la Usina, gan칩 el Premio Goya a la mejor pel칤cula iberoamericana. 游녪游낕游녪游낕游녪游낕游녪游낕游녪游낕  #Goya2020  https://t.co/CEr2MPCMBi",megustaleerarg,316429650,2020-01-26,09:49:40,215,1,27,['goya2020'],"[{'screen_name': 'eduardosacheri', 'name': 'eduardo sacheri', 'id': '278231789'}]",False,,,,
1220755484887736322,1220755484887736322,"La propuesta de un viaje enfrenta a Hanka con im치genes de un pasado que se propuso olvidar. La invasi칩n alemana, el ghetto y luego Auschwitz cambiar치n para siempre su mundo: Hanka 753, la apasionante y cruel historia de una sobreviviente del horror   https://t.co/pwkMfu0Jn9  https://t.co/pMkbgpUH9P",megustaleerarg,316429650,2020-01-24,14:09:22,14,0,2,[],[],False,,,,
1220725863328690177,1220725863328690177,"춰Felicitaciones Guillermo Arriaga (@G_Arriaga)!, ganador del #PremioAlfaguara2020 por su novela Salvar el fuego:   https://t.co/PbQbbXaFYd  https://t.co/TkyTbXEpZR",megustaleerarg,316429650,2020-01-24,12:11:40,3,0,1,['premioalfaguara2020'],"[{'screen_name': 'g_arriaga', 'name': 'guillermo arriaga', 'id': '73168194'}]",False,,,,
1220723561847033858,1220715499782397952,"Pilar Reyes, editora central de Alfaguara: ""La novela ganadora ha sido ganadora luego de una conversaci칩n larga y seria sobre siete finalistas""  https://t.co/CrlNy42UI6 #PremioAlfaguara2020  https://t.co/4Ce4XCRAT1",megustaleerarg,316429650,2020-01-24,12:02:31,2,0,0,['premioalfaguara2020'],[],False,,,,
1220720208068956161,1220715499782397952,游댮 Segu칤 la transmisi칩n del #PremioAlfaguara2020:  https://t.co/CrlNy42UI6,megustaleerarg,316429650,2020-01-24,11:49:12,1,1,0,['premioalfaguara2020'],[],False,,,,
1220720050870652933,1220715499782397952,"Arriaga: ""Creo que la distribuci칩n de la riqueza ha sido muy injusta y ha creado dos M칠xico absolutamente separados"" #PremioAlfaguara2020  https://t.co/qPMUwJJwUV",megustaleerarg,316429650,2020-01-24,11:48:34,3,1,0,['premioalfaguara2020'],[],False,,,,
1220719174676295682,1220715499782397952,"Arriaga: ""Al final toda mi obra ha sido una reflexi칩n sobre el amor"" #PremioAlfaguara2020  https://t.co/ArVP1Xtq2L",megustaleerarg,316429650,2020-01-24,11:45:05,3,1,1,['premioalfaguara2020'],[],False,,,,
1220718855418523648,1220715499782397952,El jurado del #PremioAlfaguara2020:   Antonio Lucas Edurne Portela Juan Villoro  Jes칰s R. Trueba Laura Alcoba Pilar Reyes (con voz pero sin voto)  https://t.co/tMYPTQ3aBT,megustaleerarg,316429650,2020-01-24,11:43:49,3,1,0,['premioalfaguara2020'],[],False,,,,
1220718047088074754,1220715499782397952,"游댮 Villoro: ""La novela de Guillermo Arriaga (foto) es una novela polif칩nica en el M칠xico contempor치neo que se sirve de una extraordinaria fuerza visual para lograr una obra de inquietante verosimilitud"" #PremioAlfaguara2020  https://t.co/0fkkEC2bcn",megustaleerarg,316429650,2020-01-24,11:40:36,5,1,0,['premioalfaguara2020'],[],False,,,,
