id,conversation_id,tweet,username,user_id,date,time,likes_count,replies_count,retweets_count,hashtags,mentions,retweet,quote_url,user_rt_id,source,retweet_date
1115261424450846721,1115261424450846721,"游늷  @Marian_Carbajal presenta Yo te creo, hermana junto a @claudiapineiro, @soythelmafardin, @lucianapeker y @natstoppani:  https://t.co/iYjPPkfjd0  游딉  Mi칠rcoles 17 de abril 游뎾 19hs 游꿞 Entrada libre y gratuita  游늸Centro Cultural de la Cooperaci칩n | Av. Corrientes 1543  https://t.co/oHM9cDHh8X",megustaleerarg,316429650,2019-04-08,11:33:38,21,1,2,[],"[{'screen_name': 'marian_carbajal', 'name': 'mariana carbajal', 'id': '547336041'}, {'screen_name': 'claudiapineiro', 'name': 'claudia pi침eiro 游눜', 'id': '128205366'}, {'screen_name': 'soythelmafardin', 'name': 'thelma fardin', 'id': '1061108300350193664'}, {'screen_name': 'lucianapeker', 'name': 'luciana peker', 'id': '147791121'}, {'screen_name': 'natstoppani', 'name': 'nat stoppani', 'id': '810516995041099776'}]",False,,,,
1115250723980234752,1115250723980234752,"Rese침a | La conquista, Iris y Construcci칩n, el nuevo libro de Sergio Bizzio en @perfildiario: tres cuentos que son a su vez tres construcciones imposibles y fascinantes de uno de los autores m치s singulares de la narrativa contempor치nea de habla hispana  https://t.co/NRRf5zOVZT  https://t.co/gJVCt9fFSX",megustaleerarg,316429650,2019-04-08,10:51:07,1,0,0,[],"[{'screen_name': 'perfildiario', 'name': 'diario perfil', 'id': '175881965'}]",False,,,,
1115223598338326528,1115223598338326528,"Anticipo de Sodama, el nuevo libro de Frederic Martel (@martelf) en @perfildiario:  https://t.co/ixq1L59uGI  M치s sobre el libro:  https://t.co/ScIPZlOc9x  https://t.co/e9gRFbLb8v",megustaleerarg,316429650,2019-04-08,09:03:20,3,0,2,[],"[{'screen_name': 'martelf', 'name': 'frederic martel', 'id': '48322782'}, {'screen_name': 'perfildiario', 'name': 'diario perfil', 'id': '175881965'}]",False,,,,
1114301804974620677,1114301804974620677,游늷  @claudiapineiro presenta su 칰ltimo libro Qui칠n no #LeeryComer      游딉  S치bado 6 de abril 游뎾 16hs. 游꿞 Entrada gratuita  游늸 Concepci칩n Arenal 4865 | Escenario Montenegro  https://t.co/9feASwPl8x,megustaleerarg,316429650,2019-04-05,20:00:27,10,0,1,['leerycomer'],"[{'screen_name': 'claudiapineiro', 'name': 'claudia pi침eiro 游눜', 'id': '128205366'}]",False,,,,
1114226945091305472,1114226945091305472,"游닠 Diario de un hijo, el nuevo libro de @Tutehumor, que recorre la relaci칩n entre ambos desde el nacimiento del autor hasta la muerte de Caloi.  Alegr칤as y desencantos, caminos asfaltados y maleza, lunas y alcauciles:  https://t.co/XCiYcmVjEh  https://t.co/PZVDAwDMtB",megustaleerarg,316429650,2019-04-05,15:02:59,95,1,24,[],"[{'screen_name': 'tutehumor', 'name': 'tute', 'id': '77925638'}]",False,,,,
1114221805215059968,1114221805215059968,游늷  C칩mo reconocer tus emociones para comer mejor: @KatzDra presenta su libro El m칠todo No Dieta en #LeeryComer      游딉  S치bado 7 de abril  游뎾 16:30 游꿞 Entrada gratuita  游늸Concepci칩n Arenal 4865 | Auditoria Margen del Mundo  https://t.co/o6B9NwEsk7,megustaleerarg,316429650,2019-04-05,14:42:34,8,0,2,['leerycomer'],"[{'screen_name': 'katzdra', 'name': 'dra. m칩nica katz', 'id': '2510807386'}]",False,,,,
1114164908961275904,1114164908961275904,游닠낋 EN UN MINUTO | @Patricio_Pron cuenta su nuevo libro Ma침ana tendremos otros nombres:   https://t.co/ZCtRNZOTOK  https://t.co/JQ4SSujEfn,megustaleerarg,316429650,2019-04-05,10:56:29,5,0,1,[],"[{'screen_name': 'patricio_pron', 'name': 'patricio pron', 'id': '2337051416'}]",False,,,,
1113829228091408386,1113829228091408386,游늷  Para qu칠 escribimos hoy: charla de Marcelo @birmajer en #LeeryComer      游딉  Domingo 7 de abril 游뎾 13hs. 游꿞 Entrada gratuita  游늸Concepci칩n Arenal 4865 | Escenario Montenegro  https://t.co/pSAkoZlxEf,megustaleerarg,316429650,2019-04-04,12:42:36,3,1,3,['leerycomer'],"[{'screen_name': 'birmajer', 'name': 'marcelo birmajer', 'id': '484325329'}]",False,,,,
1113815323638104064,1113815323638104064,游닠 El valor del espa침ol como lengua de culturas: video el discurso completo de @claudiapineiro en @CILE2019:  https://t.co/Eipnhg8Ck2  https://t.co/qviqeYCPNb,megustaleerarg,316429650,2019-04-04,11:47:21,53,8,22,[],"[{'screen_name': 'claudiapineiro', 'name': 'claudia pi침eiro 游눜', 'id': '128205366'}, {'screen_name': 'cile2019', 'name': 'cile c칩rdoba 2019', 'id': '818543581233377282'}]",False,,,,
1113561765164519425,1113561765164519425,"El festival de literatura Metropolis Bleu de Canad치 eligi칩 la obra de @claudiapineiro para el reconocimiento Prix Azul 2019, el segundo en relevancia de los siete que entrega:  https://t.co/yMXt9UBC43",megustaleerarg,316429650,2019-04-03,18:59:48,10,0,1,[],"[{'screen_name': 'claudiapineiro', 'name': 'claudia pi침eiro 游눜', 'id': '128205366'}]",False,,,,
1113535661359935489,1113535661359935489,游닠 VIDEO del discurso completo de Mar칤a Teresa Andruetto en el cierre del Congreso Internacional de la Lengua Espa침ola en C칩rdoba:  https://t.co/IbFuA6PUn5  https://t.co/VsEKUZZpCU,megustaleerarg,316429650,2019-04-03,17:16:04,14,0,5,[],[],False,,,,
1113499736533762054,1113499736533762054,"游늷 @natikiako, autora de A cuatro manos, en la @leerycomer:  cocina natural para compartir con los chicos:  https://t.co/eTM63rR9vb #LeeryComer      游딉  S치bado 6 de abril 游뎾 18:30hs 游꿞 Entrada libre y gratuita  游늸Concepci칩n Arenal 4865 | Auditorio Margen del Mundo.  https://t.co/uM0lqfvU5E",megustaleerarg,316429650,2019-04-03,14:53:19,2,0,1,['leerycomer'],"[{'screen_name': 'natikiako', 'name': 'natalia kiako', 'id': '112466359'}, {'screen_name': 'leerycomer', 'name': 'feria leer y comer', 'id': '3056596511'}]",False,,,,
1113412474659848194,1113412474659848194,游눪游닄춰Nuestras novedades editoriales de #ABRIL!  https://t.co/XV3vzYhfMn  https://t.co/0UZLO2ZftE,megustaleerarg,316429650,2019-04-03,09:06:34,11,0,4,['abril'],[],False,,,,
1111676676524564480,1111670683115806720,"游댮 VIVO | Cebri치n: ""El mundo de internet es un mundo de m칠tricas y todo lo que no se mide por internet pr치cticamente no existe. Y, por lo tanto, la tarea del @InstCervantes de medir el uso de espa침ol es una contribuci칩n al desarrollo tecnol칩gico"".  https://t.co/qFKGY56Uo2",megustaleerarg,316429650,2019-03-29,14:09:08,0,0,0,[],"[{'screen_name': 'instcervantes', 'name': 'instituto cervantes', 'id': '267110606'}]",False,,,,
1111674943236919297,1111670683115806720,"游댮 VIVO | Pilar Reyes, editora de Alfaguara: ""La competitividad del espa침ol como lengua para el innovaci칩n es algo que no admite dudas. Lo que nos falta es incrementar nuestro peso diplom치tico, nuestras actividades econ칩micas, cient칤ficas y culturales"".  https://t.co/89V9yDItGL",megustaleerarg,316429650,2019-03-29,14:02:15,7,1,1,[],[],False,,,,
1111671070174662658,1111670683115806720,游댮 VIVO |  Primer disparador: 쮺칩mo el mundo de la educaci칩n puede permitir que el idioma espa침ol sea un acicate en la innovaci칩n en el emprendimiento?  https://t.co/Sa64X384CJ,megustaleerarg,316429650,2019-03-29,13:46:51,0,1,0,[],[],False,,,,
1111670683115806720,1111670683115806720,游댮 VIVO | La competitividad del espa침ol como lengua para la innovaci칩n y el emprendimiento: modera la mesa Juan Luis Cebri치n.  https://t.co/AkezsgXINe,megustaleerarg,316429650,2019-03-29,13:45:19,7,1,1,[],[],False,,,,
1111593590709538816,1111340727722799106,Discurso completo de @claudiapineiro en @CILE2019  https://t.co/syoagQPEep,megustaleerarg,316429650,2019-03-29,08:38:59,52,2,16,[],"[{'screen_name': 'claudiapineiro', 'name': 'claudia pi침eiro 游눜', 'id': '128205366'}, {'screen_name': 'cile2019', 'name': 'cile c칩rdoba 2019', 'id': '818543581233377282'}]",False,https://twitter.com/infobaeamerica/status/1111396295510384640?s=21,,,
1111424768987693062,1111402250994237441,"游댮 VIVO | Vargas Llosa: 럑쮼s Rayuela la gran obra de Julio Cort치zar? Yo creo que no. El Cort치zar m치s duradero, el Cort치zar eterno, ser치 probablemente el de los cuentos. Fue un cuentista con pocos equivalentes, absolutamente excepcional.  https://t.co/qsfTtDXv5t",megustaleerarg,316429650,2019-03-28,21:28:08,13,2,3,[],[],False,,,,
1111423377888022528,1111402250994237441,游댮 VIVO | Vargas Llosa: Las convenciones con las que est치 escrita Rayuela no son las convenciones con las que nos movemos en el mundo.  https://t.co/BNZvLwo1RZ,megustaleerarg,316429650,2019-03-28,21:22:37,9,1,1,[],[],False,,,,
1111422820695703553,1111402250994237441,游댮 VIVO | Vargas Llosa: Rayuela fue la primera novela que introduc칤a el juego como un elemento absolutamente esencial.,megustaleerarg,316429650,2019-03-28,21:20:24,8,1,2,[],[],False,,,,
1111422302191673347,1111402250994237441,游댮 VIVO | Vargas Llosa: Rayuela es una novela de una extraordinaria libertad que Cort치zar manifestaba en su manera de vivir y escribir.  https://t.co/m5BjejWGbM,megustaleerarg,316429650,2019-03-28,21:18:20,12,1,4,[],[],False,,,,
1111421706092986368,1111402250994237441,"VIVO | Vargas Llosa: El mundo de Cort치zar era un mundo de libros, de pinturas, de b칰squeda de cosas raras. Recuerdo que un d칤a Julio me pidi칩 que lo acompa침ara a un Congreso de brujas y adivinadoras. Me aburr칤 espantosamente pero 칠l se divirti칩 much칤simo.  https://t.co/FSjFZ5oHNO",megustaleerarg,316429650,2019-03-28,21:15:58,8,1,1,[],[],False,,,,
1111420823242326019,1111402250994237441,游댮 VIVO | Vargas Llosa: Durante la escritura de Rayuela me sorprend칤a much칤simo que me contara que hab칤a d칤as que se sentaba en la m치quina de escribir y no sab칤a qu칠 iba a pasar esa ma침ana en la novela.  https://t.co/zqpjVJCnRG,megustaleerarg,316429650,2019-03-28,21:12:28,10,1,3,[],[],False,,,,
1111419959719002112,1111402250994237441,游댮 VIVO | Vargas Llosa: Cuando nos conocimos Cort치zar ten칤a 22 a침os m치s que yo. Era un personaje que ten칤a garantizada la eterna juventud.  https://t.co/HLa6u4OwFs,megustaleerarg,316429650,2019-03-28,21:09:02,8,1,2,[],[],False,,,,
1111419143520083971,1111402250994237441,"游댮 VIVO | Mario Vargas Llosa: Rayuela hubiese sido inconcebible sin la personalidad de su autor ni de sus intereses, su curiosidad, sus apetitos.  https://t.co/HZOSoAUek0",megustaleerarg,316429650,2019-03-28,21:05:47,11,1,2,[],[],False,,,,
1111416237026762754,1111402250994237441,Cabut칤: Como editores de Julio Cort치zar esta edici칩n nos permite acercar la novela a nuevos lectores generaci칩n tras generaci칩n.,megustaleerarg,316429650,2019-03-28,20:54:14,3,1,0,[],[],False,,,,
1111416096890871808,1111402250994237441,"游댮 VIVO | Cabut칤: 15 a침os despu칠s de la publicaci칩n de la edici칩n especial de El Quijote publicamos Rayuela, una novela y un autor que rompieron todos los moldes de la narrativa contempor치nea.  https://t.co/6zWO4uOrtf",megustaleerarg,316429650,2019-03-28,20:53:41,3,0,0,[],[],False,,,,
1111415302296735749,1111402250994237441,"游댮 VIVO | Nuria Cabut칤, Penguin Random House Grupo Editorial: El espa침ol es una patria com칰n. Creemos que las grandes obras escritas en nuestro idioma son un patrimonio de nuestra historia y eso transmitimos a nuestros lectores.  https://t.co/eWykY0uqvw",megustaleerarg,316429650,2019-03-28,20:50:31,4,2,2,[],[],False,,,,
1111402250994237441,1111402250994237441,游댮 VIVO | En minutos comienza la presentaci칩n de la edici칩n conmemorativa de Rayuela en el Teatro Real de C칩rdoba.  https://t.co/GdiFIObLt7,megustaleerarg,316429650,2019-03-28,19:58:40,23,1,1,[],[],False,,,,
1111387726887043076,1111387726887043076,"Manu, el cielo con las manos, el libro de @DanielFresco tiene m치s de cien entrevistas y una reconstrucci칩n minuciosa de su vida que, a prop칩sito de su retiro, analiza su legado y su proyecci칩n para el futuro.  https://t.co/4nSFpNWVt9",megustaleerarg,316429650,2019-03-28,19:00:57,13,0,2,[],"[{'screen_name': 'danielfresco', 'name': 'daniel fresc칩', 'id': '144676425'}]",False,,,,
1111356327631224832,1111340727722799106,Ovaci칩n para la versi칩n qom de Cinco siglos igual de @claudiapineiro en @CILE2019.  https://t.co/dVb5YHmUlu,megustaleerarg,316429650,2019-03-28,16:56:11,85,3,24,[],"[{'screen_name': 'claudiapineiro', 'name': 'claudia pi침eiro 游눜', 'id': '128205366'}, {'screen_name': 'cile2019', 'name': 'cile c칩rdoba 2019', 'id': '818543581233377282'}]",False,,,,
1111340727722799106,1111340727722799106,游댮 VIVO | El valor del espa침ol como lengua de culturas: ponencia de @claudiapineiro.  https://t.co/UeEUxMvj2X,megustaleerarg,316429650,2019-03-28,15:54:11,10,1,1,[],"[{'screen_name': 'claudiapineiro', 'name': 'claudia pi침eiro 游눜', 'id': '128205366'}]",False,,,,
1111311357599797248,1111311357599797248,"La edici칩n conmemorativa de Rayuela, de Julio Cort치zar, en nuestro stand (N칰mero 101) de @FestiLaPalabra y @CILE2019 en C칩rdoba.  https://t.co/HH0Wq9mHvk",megustaleerarg,316429650,2019-03-28,13:57:29,34,2,10,[],"[{'screen_name': 'cile2019', 'name': 'cile c칩rdoba 2019', 'id': '818543581233377282'}]",False,,,,
1111275201889816576,1111275201889816576,"#UnD칤aComoHoy pero de 1936 nac칤a Mario Vargas Llosa, escritor y pol칤tico peruano, Premio Nobel de Literatura en 2010.  https://t.co/gjcaDPvEus",megustaleerarg,316429650,2019-03-28,11:33:49,33,2,2,['und칤acomohoy'],[],False,,,,
1111273944005386241,1111273944005386241,游꿩游꿭 Prueba de sonido en el Teatro Real de C칩rdoba en la previa de la presentaci칩n de la edici칩n conmemorativa de Rayuela.   游꿞 #CILECORDOBA #TenemosLaPalabra  游딉  Hoy Jueves 28/03 游뎾 20hs 游늸 Teatro Real de C칩rdoba.  https://t.co/R5XXqYdxBV,megustaleerarg,316429650,2019-03-28,11:28:49,2,0,0,"['cilecordoba', 'tenemoslapalabra']",[],False,,,,
1111264257990184961,1111260504125784065,"游댮 VIVO | @sergioramirezm: Transgredir es traspasar los l칤mites. Traspasar es trascender. El espa침ol es una lengua que va de un lado a otro, una lengua sin descanso que no se asusta de su naturaleza h칤brida .  https://t.co/gjVJqenwHK",megustaleerarg,316429650,2019-03-28,10:50:20,10,0,6,[],"[{'screen_name': 'sergioramirezm', 'name': 'sergio ram칤rez', 'id': '272066759'}]",False,,,,
1111263678379319298,1111260504125784065,游닄 @sergioramirezm: No debemos olvidar que quien produce la tecnolog칤a bautiza sus frutos.,megustaleerarg,316429650,2019-03-28,10:48:01,0,1,0,[],"[{'screen_name': 'sergioramirezm', 'name': 'sergio ram칤rez', 'id': '272066759'}]",False,,,,
1111260504125784065,1111260504125784065,游댮 VIVO | Lengua e interculturalidad: ponencia general de @sergioramirezm en @CILE2019.  https://t.co/sRuOSIltSl,megustaleerarg,316429650,2019-03-28,10:35:25,1,1,0,[],"[{'screen_name': 'sergioramirezm', 'name': 'sergio ram칤rez', 'id': '272066759'}, {'screen_name': 'cile2019', 'name': 'cile c칩rdoba 2019', 'id': '818543581233377282'}]",False,,,,
1111252085696270337,1111252085696270337,"Manu, el cielo con las manos, el libro de @DanielFresco tiene m치s de cien entrevistas y una reconstrucci칩n minuciosa de su vida que, a prop칩sito de su retiro, analiza su legado y su proyecci칩n para el futuro.  https://t.co/4nSFpNWVt9",megustaleerarg,316429650,2019-03-28,10:01:57,8,0,2,[],"[{'screen_name': 'danielfresco', 'name': 'daniel fresc칩', 'id': '144676425'}]",False,,,,
1111028944575320070,1111018740903235589,游댮 VIVO | Gallego-D칤az: Creo que el lenguaje es una construcci칩n humana y tiene un desarrollo que afortunadamente no tiene que ver con las imposiciones.  https://t.co/7ZqVEcYKku,megustaleerarg,316429650,2019-03-27,19:15:16,4,0,0,[],[],False,,,,
1111024991108300800,1111024991108300800,游댮 VIVO | El espa침ol y la sociedad digital: segu칤 en directo la charla de @fernandezdiazok y Soledad Gallego-D칤az.   https://t.co/zxoOmgsSTS,megustaleerarg,316429650,2019-03-27,18:59:34,3,0,1,[],"[{'screen_name': 'fernandezdiazok', 'name': 'jorge fern치ndez d칤az', 'id': '709800285108105216'}]",False,,,,
1111023451861598208,1111018740903235589,"Gallego-D칤az: Hay palabras que aparecen y desaparecen pero creo que eso es una riqueza. Los medios no tenemos por qu칠 combatirlo, tenemos que contar qu칠 ocurre y por qu칠. No veo ning칰n peligro a usar palabras nuevas.  https://t.co/PLEB8KxR7C",megustaleerarg,316429650,2019-03-27,18:53:27,4,1,1,[],[],False,,,,
1111021026366930944,1111018740903235589,Gallego-D칤az: El manual tiene una serie de principios para entender que el lenguaje debe ser claro. Tenemos una responsabilidad y eso figura en el lenguaje. El lector tienen que entender lo que est치s diciendo.  https://t.co/DDtpDXqq2v,megustaleerarg,316429650,2019-03-27,18:43:49,1,1,0,[],[],False,,,,
1111020595976855554,1111018740903235589,Gallego-D칤az: Cuando asum칤 en la redacci칩n dije que a lo 칰nico que hab칤a que obedecer es al libro de estilo.  https://t.co/9yJoaJYCXr,megustaleerarg,316429650,2019-03-27,18:42:06,1,1,0,[],[],False,,,,
1111019989522354176,1111018740903235589,游댮 VIVO | @fernandezdiazok: No creo que el espa침ol est칠 bajo acecho. Me parece una mirada demasiado paranoica.  https://t.co/6qcfHN4QxU,megustaleerarg,316429650,2019-03-27,18:39:41,2,1,0,[],"[{'screen_name': 'fernandezdiazok', 'name': 'jorge fern치ndez d칤az', 'id': '709800285108105216'}]",False,,,,
1111018740903235589,1111018740903235589,"游댮 VIVO | El espa침ol y la sociedad digital: sesi칩n plenaria especial con @claudiapineiro, @fernandezdiazok y Soledad Gallego-D칤az.  https://t.co/aozzWUkiTF",megustaleerarg,316429650,2019-03-27,18:34:44,5,1,0,[],"[{'screen_name': 'claudiapineiro', 'name': 'claudia pi침eiro 游눜', 'id': '128205366'}, {'screen_name': 'fernandezdiazok', 'name': 'jorge fern치ndez d칤az', 'id': '709800285108105216'}]",False,,,,
1110997016828669952,1110997016828669952,"游댮 VIVO |  El espa침ol, lengua universal: ponencia general de la escritora brasile침a N칠lida Pi침칩n.  https://t.co/3HM7iQejpf",megustaleerarg,316429650,2019-03-27,17:08:24,3,0,0,[],[],False,,,,
1110923019889856513,1110923019889856513,Nuestro stand en el @FestiLaPalabra frente al Cabildo de C칩rdoba #CILE2019  https://t.co/bojHe7jFVP,megustaleerarg,316429650,2019-03-27,12:14:22,15,0,3,['cile2019'],[],False,,,,
1110917202306306052,1110891370850537472,"游댮 VIVO |  Mario Vargas Llosa: ""Am칠rica era una torre de Babel cuando llegaron los europeos y estaba, literalmente, ba침ada en sangre. Las controversias que ha generado la conquista desaparecen cuando se trata de la lengua"" #CILECORDOBA  https://t.co/vczSVfpiTC",megustaleerarg,316429650,2019-03-27,11:51:15,81,75,40,['cilecordoba'],[],False,,,,
1110913642776666112,1110913642776666112,"El espa침ol y la sociedad digital: sesi칩n plenaria especial con @claudiapineiro, @fernandezdiazok y Soledad Gallego-D칤az.  游꿞 #CILECORDOBA #TenemosLaPalabra  游딉  Hoy Martes 27/03 游뎾 17:30-18hs 游늸 Teatro del Libertador San Mart칤n / Sala de las Am칠ricas, Pabell칩n Argentina.  https://t.co/ViFM652Ij8",megustaleerarg,316429650,2019-03-27,11:37:06,5,0,0,"['cilecordoba', 'tenemoslapalabra']","[{'screen_name': 'claudiapineiro', 'name': 'claudia pi침eiro 游눜', 'id': '128205366'}, {'screen_name': 'fernandezdiazok', 'name': 'jorge fern치ndez d칤az', 'id': '709800285108105216'}]",False,,,,
1110905142147272705,1110891370850537472,"游댮 VIVO |  Mauricio Macri: ""La lengua es nuestro mayor activo, es la riqueza mejor distribuida de nuestra comunidad y depende de nosotros mantenerla viva"" #CILECORDOBA  https://t.co/PdwSN7AcNz",megustaleerarg,316429650,2019-03-27,11:03:20,13,3,4,['cilecordoba'],[],False,,,,
1110902723329822725,1110891370850537472,"游댮 VIVO |  Felipe VI: ""Vuestro Borges, nuestro Borges, dej칩 escrito que el idioma no es s칩lo un instrumento de expresi칩n ni comunicaci칩n si no una tradici칩n y un destino"" #CILECORDOBA  https://t.co/CEZblRWzvH",megustaleerarg,316429650,2019-03-27,10:53:43,12,1,4,['cilecordoba'],[],False,,,,
1110902134663507968,1110891370850537472,"游댮 VIVO |  Felipe VI: ""Debemos saludar a la gloriosa Universidad de C칩rdoba. La UNC es universalmente conocida por el esfuerzo de responder a las exigencias de los tiempos adaptando los principios b치sicos de libertad de pensamiento y los nuevos horizontes sociales"" #CILECORDOBA  https://t.co/oiwPO6frcg",megustaleerarg,316429650,2019-03-27,10:51:23,10,1,4,['cilecordoba'],[],False,,,,
1110901436727115781,1110891370850537472,"游댮 VIVO |  S. M el Rey de Espa침a Felipe VI: ""En el Congreso de Rosario se produjo un cambio inesperado: los ciudadanos se adue침aron del congreso populariz치ndolo"".  https://t.co/WSM3TSO8om",megustaleerarg,316429650,2019-03-27,10:48:36,6,1,1,[],[],False,,,,
1110898850833842178,1110891370850537472,"游댮 VIVO |  Santiago Mu침oz Machado, director de la Real Academia Espa침ola y presidente de la Asociaci칩n de Academias de la Lengua Espa침ola: ""El Congreso se propone poner en valor al espa침ol como lengua americana que ha generado particularidades ling칲칤sticas en cada naci칩n"".  https://t.co/1mRNb0W0Iv",megustaleerarg,316429650,2019-03-27,10:38:20,5,1,1,[],[],False,,,,
1110896857079779329,1110891370850537472,"游댮 VIVO |  Garc칤a Montero: ""Que la palabra pierda su profundidad po칠tica es tan peligroso como que la tecnolog칤a caiga en la tentaci칩n de separarse en sus progresos de la dignidad de los seres humanos"" #CILECORDOBA  https://t.co/Pf5gPDqLfR",megustaleerarg,316429650,2019-03-27,10:30:24,7,1,1,['cilecordoba'],[],False,,,,
1110895648893747203,1110891370850537472,"游댮 VIVO |  Luis Garc칤a Montero, director del @InstCervantes, en la apertura del @CILE2019: ""Los retos del idioma tienen que ver con los retos de la convivencia democr치tica: la voluntad de hacer participe en condiciones de igualdad un patrimonio com칰n"" #CILECORDOBA  https://t.co/2gZZQ88PBl",megustaleerarg,316429650,2019-03-27,10:25:36,4,1,4,['cilecordoba'],"[{'screen_name': 'instcervantes', 'name': 'instituto cervantes', 'id': '267110606'}, {'screen_name': 'cile2019', 'name': 'cile c칩rdoba 2019', 'id': '818543581233377282'}]",False,,,,
1110892874118455297,1110892874118455297,"El espa침ol, lengua universal: ponencia general de la escritora brasile침a N칠lida Pi침칩n.   游꿞 #CILECORDOBA #TenemosLaPalabra  游딉  Hoy Martes 27/03 游늸 Teatro del Libertador San Mart칤n / Saa de las Am칠ricas, Pabell칩n Argentina 游뎾 16:30 - 17hs  https://t.co/123qYjp4tc",megustaleerarg,316429650,2019-03-27,10:14:35,3,0,0,"['cilecordoba', 'tenemoslapalabra']",[],False,,,,
1110891370850537472,1110891370850537472,游댮 VIVO |  Segu칤 la transmisi칩n en directo del VIII Congreso Internacional de la Lengua Espa침ola:  https://t.co/GAi5w7V5ou  https://t.co/p2WWsByzJW,megustaleerarg,316429650,2019-03-27,10:08:36,15,1,4,[],[],False,,,,
1110690189926649863,1110663631396585472,@laflorans @claudiapineiro @FestiLaPalabra Para conseguir la bolsa 游녢  https://t.co/YQ5muTPbQ9,megustaleerarg,316429650,2019-03-26,20:49:11,3,0,0,[],[],False,https://twitter.com/megustaleerarg/status/1109256174585688064?s=21,,,
1110684214683451392,1110663631396585472,游녤 @claudiapineiro posa con su bolsa de #HARTA en el cierre de su charla en @FestiLaPalabra en C칩rdoba.  https://t.co/E8A8w9w6Ct,megustaleerarg,316429650,2019-03-26,20:25:26,27,1,3,['harta'],"[{'screen_name': 'claudiapineiro', 'name': 'claudia pi침eiro 游눜', 'id': '128205366'}]",False,,,,
1110677746726944769,1110663631396585472,Los elegidos de @claudiapineiro para llevarse a una isla desierta 游꺖游녢  https://t.co/WVudtZ3X8D,megustaleerarg,316429650,2019-03-26,19:59:44,13,2,3,[],"[{'screen_name': 'claudiapineiro', 'name': 'claudia pi침eiro 游눜', 'id': '128205366'}]",False,,,,
1110674437379186693,1110663631396585472,"游닄 @claudiapineiro sobre la importancia de algunos libros olvidados: Yo creo que la lectura es como una guerra de guerrilla. El libro Enero, de Sara Gallardo, estaba discontinuado y por suerte se reedit칩  https://t.co/rq5kNEdfmp",megustaleerarg,316429650,2019-03-26,19:46:35,8,1,1,[],"[{'screen_name': 'claudiapineiro', 'name': 'claudia pi침eiro 游눜', 'id': '128205366'}]",False,,,,
1110669093701632000,1110663631396585472,"游닄 Joan Didion, @Cabezoncamara, @sschweblin, Camila Sosa Villada, @cynthiaedul y Natalia Ginzburg entre las lecturas elegidas por @claudiapineiro.  https://t.co/f4BbmxdBUv",megustaleerarg,316429650,2019-03-26,19:25:21,28,0,3,[],"[{'screen_name': 'cabezoncamara', 'name': 'cabez칩n c치mara', 'id': '57455434'}, {'screen_name': 'sschweblin', 'name': 'samanta schweblin', 'id': '1478259620'}, {'screen_name': 'cynthiaedul', 'name': 'cynthia edul', 'id': '150126288'}, {'screen_name': 'claudiapineiro', 'name': 'claudia pi침eiro 游눜', 'id': '128205366'}]",False,,,,
1110668000577896449,1110663631396585472,Juliana Rodr칤guez Salvador y @claudiapineiro a la sala llena en el Cabildo de C칩rdoba.  https://t.co/KBJPHfs7NL,megustaleerarg,316429650,2019-03-26,19:21:01,9,2,1,[],"[{'screen_name': 'claudiapineiro', 'name': 'claudia pi침eiro 游눜', 'id': '128205366'}]",False,,,,
1110663631396585472,1110663631396585472,En minutos... 游녢,megustaleerarg,316429650,2019-03-26,19:03:39,5,1,0,[],[],False,https://twitter.com/megustaleerarg/status/1109424743336284160,,,
1110612063649517569,1110603393645596697,游꿟 @eduardosacheri: La versi칩n estadounidense de El secreto de sus ojos no tiene pasi칩n y no tiene humor.  https://t.co/Utjm3YjpUI,megustaleerarg,316429650,2019-03-26,15:38:44,3,0,0,[],"[{'screen_name': 'eduardosacheri', 'name': 'eduardo sacheri', 'id': '278231789'}]",False,,,,
