id,conversation_id,tweet,username,user_id,date,time,likes_count,replies_count,retweets_count,hashtags,mentions,retweet,quote_url,user_rt_id,source,retweet_date
1322991803373703168,1322991803373703168,"Arturo @perezreverte habla de su nueva novela, L칤nea de fuego, en @LANACION. Novedad de noviembre ya en todas las librer칤as del pa칤s.  https://t.co/X2QQZmfOpz",megustaleerarg,316429650,2020-11-01,17:00:00,0,0,0,[],"[{'screen_name': 'perezreverte', 'name': 'arturo p칠rez-reverte', 'id': '111933542'}, {'screen_name': 'lanacion', 'name': 'la nacion', 'id': '33989170'}]",False,,,,
1322926246112755714,1322926246112755714,"Dale Carnegie escribi칩 su famoso libro C칩mo ganar amigos e influir sobre las personas en 1936. A 65 a침os de su muerte, su legado se compone de un conjunto de principios esenciales que hoy forman parte de sus libros.  https://t.co/zwS5pz5tGo",megustaleerarg,316429650,2020-11-01,12:39:30,4,0,0,[],[],False,,,,
1322901205648089090,1322901205648089090,"Anticipo de Desobediencia civil y libertad responsable, el nuevo libro de Juan Jos칠 Sebreli, en @infobae. Novedad de noviembre en todas las librer칤as del pa칤s.   https://t.co/AIs8g4kasW",megustaleerarg,316429650,2020-11-01,11:00:00,2,0,2,[],"[{'screen_name': 'infobae', 'name': 'infobae', 'id': '69416519'}]",False,,,,
1322886111136522246,1322886111136522246,En diciembre en librer칤as 游녢  https://t.co/RkiRSslit9,megustaleerarg,316429650,2020-11-01,10:00:01,44,1,7,[],[],False,,,,
1322629420012679168,1322629420012679168,"Anticipo de A bailar con Maga, de Magal칤 Castagno, la tiktoker m치s popular de Argentina en @perfildiario.   https://t.co/cC7l0PdroP",megustaleerarg,316429650,2020-10-31,17:00:01,2,0,1,[],"[{'screen_name': 'perfildiario', 'name': 'diario perfil', 'id': '175881965'}]",False,,,,
1322584115477176328,1322584115477176328,"Anticipo de El apasionante origen de las palabras, de @d_balmaceda, en Spot de @clarincom.   https://t.co/gbdEAgmfzD",megustaleerarg,316429650,2020-10-31,14:00:00,9,0,2,[],"[{'screen_name': 'd_balmaceda', 'name': 'daniel balmaceda', 'id': '119175667'}, {'screen_name': 'clarincom', 'name': 'clar칤n', 'id': '8105922'}]",False,,,,
1322562239661039617,1322562239661039617,"C치daver exquisito, de @AgusBazterrica, compite por el premio al mejor libro del a침o en la categor칤a de terror en Goodreads.  https://t.co/WuYoV2dbjf",megustaleerarg,316429650,2020-10-31,12:33:04,35,0,2,[],"[{'screen_name': 'agusbazterrica', 'name': 'agustina bazterrica游눜游낍勇끂u200d游깯', 'id': '409594673'}]",False,,,,
1322535563430383626,1322535563430383626,"游꾺 Libros de miedo, misterio y fantas칤a para Noche de Brujas 游놑   Mir치 nuestra selecci칩n para #Halloween  https://t.co/9vDojhdCHX  https://t.co/GcTtitUiXw",megustaleerarg,316429650,2020-10-31,10:47:04,4,0,0,['halloween'],[],False,,,,
1322267029823320066,1322267029823320066,"La guerra invisible, la historia jam치s contada de la invasi칩n brit치nica al continente, el nuevo libro de @mlarraquy. 춰Ya en librer칤as!  https://t.co/KYGpgSODG6  https://t.co/zDVCiCpjmC",megustaleerarg,316429650,2020-10-30,17:00:01,9,0,1,[],"[{'screen_name': 'mlarraquy', 'name': 'marcelo larraquy', 'id': '257111357'}]",False,,,,
1322261177368498176,1322261172951961601,"Mirada desde el presente, aquella haza침a hist칩rica alcanza ribetes de leyenda: c칩mo lo logr칩, junto a sus compa침eros, contra todo y contra todos, narrado en primera persona por Maradona:  https://t.co/QOEYnTvXAT  https://t.co/GqdIDjmcPd",megustaleerarg,316429650,2020-10-30,16:36:45,0,0,0,[],[],False,,,,
1322261172951961601,1322261172951961601,"En M칠xico 86. Mi Mundial, mi verdad, Diego Maradona cuenta por primera vez y en primera persona detalles in칠ditos de aquel campeonato inolvidable  https://t.co/40t91WYkHn",megustaleerarg,316429650,2020-10-30,16:36:44,3,2,1,[],[],False,,,,
1322194930639507456,1322194930639507456,游눪游닄 춰Nuestras novedades editoriales de #NOVIEMBRE!    https://t.co/D1pBkMMBIj  https://t.co/8U2By9McvB,megustaleerarg,316429650,2020-10-30,12:13:31,3,1,0,['noviembre'],[],False,,,,
1322182590808424449,1322182590808424449,"Margaret Atwood es una de las escritoras canadienses de mayor renombre internacional. Autora prol칤fica, ha cultivado diversos g칠neros literarios y su obra ha sido traducida a m치s de cuarenta idiomas #ViernesdeCitas  https://t.co/1DkN4vsT1V",megustaleerarg,316429650,2020-10-30,11:24:29,10,0,0,['viernesdecitas'],[],False,,,,
1321844785339138056,1321844785339138056,"游닠 @santiodonnell, autor de Hermano, con @VHMok y @ischargro en @C5N  https://t.co/Dk4GDEul2j",megustaleerarg,316429650,2020-10-29,13:02:10,9,0,5,[],"[{'screen_name': 'santiodonnell', 'name': ""santiago o'donnell"", 'id': '61081201'}, {'screen_name': 'vhmok', 'name': 'v칤ctor hugo', 'id': '177342424'}, {'screen_name': 'ischargro', 'name': 'iv치n schargrodsky', 'id': '132360268'}, {'screen_name': 'c5n', 'name': 'c5n', 'id': '152325528'}]",False,,,,
1321812828790116359,1321812828790116359,"Un hombre inocente es condenado por un asesinato hace veintid칩s a침os. Su abogado no parar치 hasta verle libre. Pero quienes le encerraron ya mataron una vez. Y est치n preparados para volver a hacerlo. Los guardianes, la nueva novela de John Grisham:   https://t.co/vbyi2r1UFP  https://t.co/9hsk3iWuRq",megustaleerarg,316429650,2020-10-29,10:55:11,7,0,0,[],[],False,,,,
1321808568727851008,1321808568727851008,"Cad치ver exquisito, de @AgusBazterrica, entre las novelas de terror que compiten en @goodreads.",megustaleerarg,316429650,2020-10-29,10:38:15,12,0,1,[],"[{'screen_name': 'agusbazterrica', 'name': 'agustina bazterrica游눜游낍勇끂u200d游깯', 'id': '409594673'}, {'screen_name': 'goodreads', 'name': 'goodreads', 'id': '15898172'}]",False,https://twitter.com/lncultura/status/1321584907085336576,,,
1321519850418851840,1321519850418851840,"Tiny Pretty Things, de Dhonielle Clayton y Sona Charaipotra, es el libro en que se basa la serie de Netflix que sigue la vida de Gigi, Bette y June. Ellas son dulces y perfectas, pero pueden ser muy malvadas:   https://t.co/6Af8bBW7IO  https://t.co/RFOHCZwfQC",megustaleerarg,316429650,2020-10-28,15:30:59,3,0,0,[],[],False,,,,
1321186758126637056,1321186758126637056,游닡游꿚仇벒잺,megustaleerarg,316429650,2020-10-27,17:27:24,7,0,0,[],[],False,https://twitter.com/Patricio_Pron/status/1321167840846745602,,,
1321182565542301700,1321182565542301700,"Poeta, novelista y autora de relatos, la obra de Sylvia Plath se ha convertido en un cl치sico contempor치neo. A 88 a침os de su nacimiento, un cl치sico reeditado a 50 a침os de su publicaci칩n y un relato in칠dito escrito cuando ten칤a veinte a침os.  https://t.co/vU01sUDmsA",megustaleerarg,316429650,2020-10-27,17:10:44,17,0,4,[],[],False,,,,
1321157457968848898,1321157457968848898,"Anticipo de L칤nea de fuego, la nueva novela de Arturo @perezreverte, que en noviembre llega a todas las librer칤as.   https://t.co/X2QQZmfOpz",megustaleerarg,316429650,2020-10-27,15:30:58,3,0,1,[],"[{'screen_name': 'perezreverte', 'name': 'arturo p칠rez-reverte', 'id': '111933542'}]",False,,,,
1321153836342530055,1321153836342530055,"Florencia Bonelli tiene publicados m치s de 20 libros. Entre ellos se cuentan, adem치s de novelas, algunos textos breves y tambi칠n cuentos para chicos. En esta infograf칤a un repaso por su vast칤sima obra:  https://t.co/ro85xJLU3E  https://t.co/hoRFmZWrQd",megustaleerarg,316429650,2020-10-27,15:16:35,48,3,7,[],[],False,,,,
1321108832140091392,1321108832140091392,"El 27 de octubre de 2002 Mar칤a Marta Garc칤a Belsunce fue asesinada en su casa del Carmel. 18 a침os despu칠s Carlos Carrascosa publica Diario de un inocente, la historia jam치s contada de un hombre que estuvo preso acusado de un crimen que no cometi칩:   https://t.co/E3soLILyCN  https://t.co/zIQf89lJQl",megustaleerarg,316429650,2020-10-27,12:17:45,0,0,0,[],[],False,,,,
1321086283553406981,1321086283553406981,"Novedad de #Noviembre: La guerra invisible, el nuevo libro de @mlarraquy.",megustaleerarg,316429650,2020-10-27,10:48:09,7,0,0,['noviembre'],"[{'screen_name': 'mlarraquy', 'name': 'marcelo larraquy', 'id': '257111357'}]",False,https://twitter.com/mlarraquy/status/1320898811070435328,,,
1320722551593684996,1320722551593684996,"Reed Hastings, el cofundador y codirector ejecutivo de Netflix, habla de Aqu칤 no hay reglas en Forbes.   https://t.co/XZfHt8pQlj",megustaleerarg,316429650,2020-10-26,10:42:48,0,0,0,[],[],False,,,,
1320706219082981381,1320706219082981381,Selva Almada habla su 칰ltima novela No es un r칤o y del cierre de la trilog칤a de varones en revista VIVA.  https://t.co/20nCoAxx9A,megustaleerarg,316429650,2020-10-26,09:37:54,7,0,3,[],[],False,,,,
1320421003709816832,1320421003709816832,"A 82 a침os de la muerte de Alfonsina Storni, una de las escritoras argentinas m치s importantes de todos los tiempos, Josefina Delgada escribe una biograf칤a que  capta la fuerza de la mujer y el talento de la escritora.  https://t.co/2zYzI5p6NH",megustaleerarg,316429650,2020-10-25,14:44:34,95,1,21,[],[],False,,,,
1320031980914921474,1320031980914921474,"Por autor/a, por sello, por g칠nero o tem치tica,  el orden de la biblioteca varia de acuerdo a cada lector/a. En el D칤a Internacional de las Bibliotecas, 쯖u치l es tu forma favorita de organizarla? 游닄仇벒잺游깯  https://t.co/0oOB4zFAWc",megustaleerarg,316429650,2020-10-24,12:58:43,64,14,3,[],[],False,,,,
1319655385645649922,1319655385645649922,"En su libro 쯇or qu칠 escribir? Philip Roth muestra el vigor, la agudeza y el poder de persuasi칩n de uno de los grandes escritores de nuestro tiempo a trav칠s de sus ensayos, entrevistas y discursos sobre la escritura, la literatura, su obra y su pa칤s. #ViernesdeCitas  https://t.co/b44KKvywPu",megustaleerarg,316429650,2020-10-23,12:02:16,9,0,0,['viernesdecitas'],[],False,,,,
1319356023090630656,1319356023090630656,"Anticipo de Hermano, el nuevo libro de @santiodonnell, en @infobae. Novedad de noviembre ya disponible en librer칤as.",megustaleerarg,316429650,2020-10-22,16:12:43,12,2,1,[],"[{'screen_name': 'santiodonnell', 'name': ""santiago o'donnell"", 'id': '61081201'}, {'screen_name': 'infobae', 'name': 'infobae', 'id': '69416519'}]",False,https://twitter.com/infobae/status/1319289300622585857,,,
1319336441521070083,1319309454463164416,Todos los tragos de los inesperados a los cl치sicos por el bartender m치s importante y carism치tico de la Argentina:  https://t.co/VxMF3m8M2o  https://t.co/F5AcF1kTWm,megustaleerarg,316429650,2020-10-22,14:54:54,1,0,1,[],[],False,,,,
1319309454463164416,1319309454463164416,"Tato Giovannoni, autor de Cocteler칤a argentina, fue elegido el mejor bartender del mundo.  https://t.co/C5S9D3KZ7y",megustaleerarg,316429650,2020-10-22,13:07:40,15,1,3,[],[],False,,,,
1319302621568638976,1319302621568638976,"Un d칤a como hoy pero de 1946 nac칤a Deepak Chopra,  m칠dico y autor de m치s de 65 libros, varios de los cuales han estado en la lista de los m치s vendidos de The New York Times.  https://t.co/rjIUWNNwbR",megustaleerarg,316429650,2020-10-22,12:40:31,8,2,3,[],[],False,,,,
1319019864577724419,1319019864577724419,Novedad de #NOVIEMBRE en librer칤as.,megustaleerarg,316429650,2020-10-21,17:56:56,4,0,0,['noviembre'],[],False,https://twitter.com/SampedroVale/status/1319008482671104005,,,
1318938955946012673,1318938955946012673,"La quinta y esperada entrega de la saga Crep칰sculo ya est치 en librer칤as. Reviv칤 con Sol de medianoche, la nueva novela de Stephenie Meyer, la historia de amor inmortal de Crep칰sculo contada desde la perspectiva de Edward Cullen:   https://t.co/2afUrcbPdK  https://t.co/nBWI5y20sB",megustaleerarg,316429650,2020-10-21,12:35:26,13,0,3,[],[],False,,,,
1318908224469389317,1318908224469389317,"Argentina primero, el nuevo best seller de @martinredrado, ya va por su sexta edici칩n: 쮼s posible construir un nuevo camino, virtuoso e inclusivo? Redrado plantea un plan para dejar de improvisar en la post pandemia y evitar las crisis recurrentes:  https://t.co/rpahGK4rLY  https://t.co/9ymhWfU1Y3",megustaleerarg,316429650,2020-10-21,10:33:19,8,1,7,[],"[{'screen_name': 'martinredrado', 'name': 'mart칤n redrado', 'id': '143529859'}]",False,,,,
1318596515305324556,1318596515305324556,"En Aqu칤 no hay reglas, @reedhastings, el cofundador @CheNetflix, revela por primera vez la fascinante historia de esta singular compa침칤a y su extraordinaria expansi칩n por el mundo entero.  https://t.co/aZuvI3EsnA",megustaleerarg,316429650,2020-10-20,13:54:42,9,0,1,[],"[{'screen_name': 'reedhastings', 'name': 'reed hastings', 'id': '15241557'}, {'screen_name': 'chenetflix', 'name': 'chenetflix', 'id': '1106274695748440064'}]",False,,,,
1318256342738608128,1318256342738608128,"Maestro de las historias de espionaje, John le Carr칠 -que naci칩 un d칤a como hoy pero 1931- cuenta en Una verdad inc칩moda una operaci칩n secreta antiterrorista en Gibraltar. La versi칩n oficial fue que todo sali칩 bien: a침os despu칠s se descubre que no fue exactamente as칤.  https://t.co/ccC81eB0sv",megustaleerarg,316429650,2020-10-19,15:22:58,9,0,1,[],[],False,,,,
1318183369356808193,1318183369356808193,"Hoy, en vivo, desde las 17 presentaci칩n de Los 70, el 칰ltimo libro de @ceferinoreato. Miralo en directo a trav칠s de Youtube:  https://t.co/68kAAwTZV3",megustaleerarg,316429650,2020-10-19,10:33:00,14,0,8,[],"[{'screen_name': 'ceferinoreato', 'name': 'ceferino reato', 'id': '172055761'}]",False,https://twitter.com/megustaleerarg/status/1315791507589390336,,,
1317890388275978240,1317890388275978240,"A partir de nueve casos reales ocurridos en la Argentina, @vidusky explica delitos como grooming, hackeo, phishing y ransomware. Cada caso sirve para conocer c칩mo funcionan las estafas y c칩mo estar prevenidos para evitarlas:  https://t.co/4EKpDDlMxj #MesazaEnCasa  https://t.co/6WrDMeXFEu",megustaleerarg,316429650,2020-10-18,15:08:48,16,0,2,['mesazaencasa'],"[{'screen_name': 'vidusky', 'name': 'sebasti치n davidovsky', 'id': '133312372'}]",False,,,,
1317887045004677121,1317887045004677121,Conoc칠 los mejores libros de nuestro cat치logo para mimar a mam치 en su d칤a y durante todo octubre:  https://t.co/QlO3pherrX  #MesdelaMadre  https://t.co/h9PxPIgGaz,megustaleerarg,316429650,2020-10-18,14:55:31,3,0,0,['mesdelamadre'],[],False,,,,
1317463565457149952,1317463565457149952,"Meteoro, como cada libro de @julianlopezok, es una m치quina expresiva, una aventura l칤rica que se abraza a la realidad como si se arrojara sobre una bomba. Para que le estalle en el pecho   https://t.co/TaTot1g9XA  https://t.co/s7ZyEXC8Tn",megustaleerarg,316429650,2020-10-17,10:52:45,2,1,1,[],"[{'screen_name': 'julianlopezok', 'name': 'l칩pez ser치 ley游눜', 'id': '1548911521'}]",False,,,,
1316895742322147328,1316895742322147328,"Una lectura l칤rica, contempor치nea y tierna sobre del amor, la infancia, el ser hijo y encontrarle un sentido a la vida en una 칠poca de desaliento y soledad. Meteoro, el nuevo libro de @julianlopezok:  https://t.co/MsKNvZFbGw  https://t.co/mg7PZTY4AE",megustaleerarg,316429650,2020-10-15,21:16:26,19,1,2,[],"[{'screen_name': 'julianlopezok', 'name': 'l칩pez ser치 ley游눜', 'id': '1548911521'}]",False,,,,
1316747124185485312,1316747124185485312,"Aunque sus primeras dos novelas tuvieron excelentes cr칤ticas, la consagraci칩n definitiva de Mario Puzo, que naci칩 un d칤a como hoy pero de 1920, lleg칩 con la publicaci칩n de El Padrino en 1969: por primera vez, la Mafia protagonizaba una novela y era retratada desde dentro.  https://t.co/Egn5oTyJrQ",megustaleerarg,316429650,2020-10-15,11:25:53,23,0,7,[],[],False,,,,
1316515804582735872,1316515804582735872,"En M치s all치 de la nutrici칩n, Emmanuel Cestaro nos brinda las herramientas fundamentales para derribar los mitos de la nutrici칩n y c칩mo tener una vida saludable:   https://t.co/0SM2NpVkc7  https://t.co/n3saoPmSAf",megustaleerarg,316429650,2020-10-14,20:06:42,6,0,0,[],[],False,,,,
1316357043788427266,1316357043788427266,"Ya en librer칤as: nueva edici칩n de Los 70, el 칰ltimo libro de @ceferinoreato sobre la d칠cada en la que Argentina lleg칩 a naturalizar la violencia pol칤tica y vivi칩 horrores que a칰n estremecen.",megustaleerarg,316429650,2020-10-14,09:35:50,9,1,5,[],"[{'screen_name': 'ceferinoreato', 'name': 'ceferino reato', 'id': '172055761'}]",False,https://twitter.com/ceferinoreato/status/1316353955715260417,,,
1316076885630218241,1316076885630218241,Elena Ferrante: la misteriosa identidad de una escritora que es un boom global en Revista VIVA   https://t.co/aIcBAiTOfU,megustaleerarg,316429650,2020-10-13,15:02:35,4,0,2,[],[],False,,,,
1316065421280280577,1316065421280280577,"Rese침a de No es un r칤o, la nueva novela de Selva Almada, en Radar de @pagina12  https://t.co/gwv8PqB6Qz",megustaleerarg,316429650,2020-10-13,14:17:02,9,0,1,[],"[{'screen_name': 'pagina12', 'name': 'p치gina|12', 'id': '775474080715767808'}]",False,,,,
1316045262624829447,1316045262624829447,"Hoy se celebra en Argentina el D칤a del Psic칩logo y nadie mejor que @Tutehumor para rendirles homenaje: en Humor al div치n, el ilustrador reflexiona en clave de humor sobre la psiquis y nuestro mundo interior.  https://t.co/LVnhmGICqD",megustaleerarg,316429650,2020-10-13,12:56:56,93,1,12,[],"[{'screen_name': 'tutehumor', 'name': 'tute', 'id': '77925638'}]",False,,,,
1315791507589390336,1315791507589390336,"Ceferino Reato presenta su 칰ltimo libro: Los '70, la historia definitiva sobre la d칠cada en la que Argentina lleg칩 a naturalizar la violencia pol칤tica y vivi칩 horrores que a칰n estremecen. Para participar de la charla: inscripci칩n (con cupos limitados) en  https://t.co/YjUtvCx0f4  https://t.co/E4Z9t2PR5I",megustaleerarg,316429650,2020-10-12,20:08:36,26,1,12,[],[],False,,,,
1315673212492156930,1314262277563047936,Carlos Carrascosa habla de Diario de un inocente con @msolamaya en @LANACION.  https://t.co/EtDA1YZA1Q,megustaleerarg,316429650,2020-10-12,12:18:32,3,0,1,[],"[{'screen_name': 'msolamaya', 'name': 'sol amaya', 'id': '23677194'}, {'screen_name': 'lanacion', 'name': 'la nacion', 'id': '33989170'}]",False,,,,
1315662822790004739,1315662822790004739,"El nuevo libro de Sandra Russo, La reinvenci칩n del amor, es un ensayo l칰cido, reflexivo y pol칤tico, sobre la decadencia del amor rom치ntico, hijo del patriarcado y del capitalismo, y el desaf칤o contempor치neo que supone reinventar los v칤nculos amorosos  https://t.co/7LhqJnVpTV  https://t.co/CYdZfvUeuf",megustaleerarg,316429650,2020-10-12,11:37:15,10,0,2,[],[],False,,,,
1315007876411392001,1315007876411392001,"Elvio Gandolfo rese침a La sangre manda, el 칰ltimo libro de @StephenKing en @IdeasLN.   https://t.co/CIJj6b85d2",megustaleerarg,316429650,2020-10-10,16:14:44,5,0,0,[],"[{'screen_name': 'stephenking', 'name': 'stephen king', 'id': '2233154425'}, {'screen_name': 'ideasln', 'name': 'la nacion ideas', 'id': '123648741'}]",False,,,,
1314972429186367489,1314972429186367489,"Un d칤a como hoy pero en 1950 nac칤a Nora Roberts, ""la escritora favorita de Am칠rica"", seg칰n la revista The New Yorker. Con m치s de cuatrocientos millones de ejemplares impresos de sus libros avalan la complicidad que Roberts consigue establecer con mujeres de todo el mundo.  https://t.co/XRedi2dazp",megustaleerarg,316429650,2020-10-10,13:53:52,5,0,0,[],[],False,,,,
1314643106592165895,1314643106592165895,"#ViernesdeCitas @Flor_Bonelli_, escritora.  https://t.co/UWb5Sk2iag",megustaleerarg,316429650,2020-10-09,16:05:16,6,0,0,['viernesdecitas'],"[{'screen_name': 'flor_bonelli_', 'name': 'florencia bonelli', 'id': '244755875'}]",False,,,,
1314595570946801664,1314595570946801664,"Fascinada con el orden desde su infancia, Marie Kondo empez칩 a ejercer como consultora de organizaci칩n a los diecinueve a침os. En sus libros La magia del orden y La felicidad en el trabajo, propone transformar tu hogar en un espacio limpio y ordenado de manera permanente.  https://t.co/CWsvAdrxcO",megustaleerarg,316429650,2020-10-09,12:56:22,9,1,3,[],[],False,,,,
1314589529345589248,1314589529345589248,"Ya en librer칤as la quinta edici칩n de Argentina primero, el nuevo best seller de @martinredrado.",megustaleerarg,316429650,2020-10-09,12:32:22,5,0,4,[],"[{'screen_name': 'martinredrado', 'name': 'mart칤n redrado', 'id': '143529859'}]",False,https://twitter.com/megustaleerarg/status/1300498486887096326,,,
1314257554697080833,1314257554697080833,"En M치s all치 de la nutrici칩n, Emmanuel Cestaro nos brinda las herramientas fundamentales para derribar los mitos de la nutrici칩n y c칩mo tener una vida saludable:  https://t.co/0SM2NpVkc7  https://t.co/0kHeadRxrs",megustaleerarg,316429650,2020-10-08,14:33:13,0,0,0,[],[],False,,,,
1314215682439958529,1314215682439958529,"Julia Navarro ha cautivado a millones de lectores y sus libros se han publicado en m치s de treinta pa칤ses en todo el mundo. T칰 no matar치s, su 칰ltimo libro publicado, es una historia absorbente que nos habla sobre la culpa, la venganza y el peso de la conciencia.  https://t.co/oOnRboKRl4",megustaleerarg,316429650,2020-10-08,11:46:50,6,0,0,[],[],False,,,,
1313911364482732032,1313911364482732032,"Anticipo de Sol de medianoche, el nuevo libro de Stephenie Meyer, en @CulturaClarin.    https://t.co/r8D4mnej0A",megustaleerarg,316429650,2020-10-07,15:37:35,8,1,1,[],"[{'screen_name': 'culturaclarin', 'name': 'clar칤n cultura', 'id': '1205592194'}]",False,,,,
1313867194040807426,1313867194040807426,La historia definitiva sobre los 70: la d칠cada en la que la Argentina lleg칩 a naturalizar la violencia pol칤tica y vivi칩 horrores que a칰n estremecen. El nuevo libro de @ceferinoreato:   https://t.co/YroZ9k608u  https://t.co/oaWXosi9UJ,megustaleerarg,316429650,2020-10-07,12:42:04,14,1,5,[],"[{'screen_name': 'ceferinoreato', 'name': 'ceferino reato', 'id': '172055761'}]",False,,,,
1313826572751773698,1313826572751773698,"Un d칤a como hoy pero de 1849 mor칤a Edgar Allan Poe Poe, referente 칰nico por sus relatos y por ser el predecesor, en cierto modo, de la novela polic칤aca moderna. Sus cuentos destacan por su belleza literaria y por fundir en ellos lo macabro con el humor, el terror y la poes칤a.  https://t.co/1CXJI5433r",megustaleerarg,316429650,2020-10-07,10:00:39,50,0,11,[],[],False,,,,
1313584168908058624,1313584152298614785,"La nueva mente del emperador: un apasionante paseo por la matem치tica y la f칤sica, y por los hallazgos del pensamiento humano.   Conseguilo ahora en eBook:  https://t.co/X4FyE0kfd1  https://t.co/HHa3aPWliq",megustaleerarg,316429650,2020-10-06,17:57:25,1,0,0,[],[],False,,,,
1313584163363196934,1313584152298614785,"El camino a la realidad: un libro definitivo e imprescindible para tener en la mano, en un solo volumen, todo el saber acumulado hasta la actualidad sobre el universo, el espacio y las leyes que lo rigen.  Conseguilo ahora en eBook:  https://t.co/PZE0s9ayxl  https://t.co/IqoASXghfv",megustaleerarg,316429650,2020-10-06,17:57:24,1,1,0,[],[],False,,,,
1313584157218439169,1313584152298614785,"Moda, fe y fantas칤a en la nueva f칤sica del universo: 쯈u칠 influencias pueden tener la moda, la fe y la fantas칤a en las investigaciones cient칤ficas que buscan entender el comportamiento del universo?     Conseguilo ahora en eBook:  https://t.co/i3pbZ9g3UL  https://t.co/6ydGepsqPw",megustaleerarg,316429650,2020-10-06,17:57:22,0,1,0,[],[],False,,,,
1313584152298614785,1313584152298614785,"Hoy se conoci칩 el Nobel de F칤sica 2020 para los investigadores Reinhard Genzel, Andrea Ghez y Roger Penrose, autor de tres cl치sicos del mundo cient칤fico.  https://t.co/jVlaFLy9OP",megustaleerarg,316429650,2020-10-06,17:57:21,2,1,3,[],[],False,,,,
1313513163137183747,1313513163137183747,"En Despierta @LorenaPronsky nos habla, de una manera honesta y visceral, sobre c칩mo superar los golpes de la vida: las p칠rdidas, el desamor y los miedos:  https://t.co/ybBxcVNnIf  https://t.co/c91GccW81Y",megustaleerarg,316429650,2020-10-06,13:15:16,4,0,0,[],"[{'screen_name': 'lorenapronsky', 'name': 'lorenapronsky', 'id': '997724885030965248'}]",False,,,,
1313206279092015106,1313206279092015106,"Con La t칤a C칩sima @Flor_Bonelli_ regresa con una historia contempor치nea donde coexisten la profesi칩n, la amistad, el amor y un pasado doloroso que, lejos de olvidarse, vuelve para regalar una segunda oportunidad:   https://t.co/W48NPOtftu  https://t.co/y6PIRuNe5s",megustaleerarg,316429650,2020-10-05,16:55:49,40,0,12,[],"[{'screen_name': 'flor_bonelli_', 'name': 'florencia bonelli', 'id': '244755875'}]",False,,,,
1313167673908396033,1313167673908396033,"Fragmento de Enga침os digitales, v칤ctimas reales, de @vidusky en @perfildiario    https://t.co/5gcL2CMNLq",megustaleerarg,316429650,2020-10-05,14:22:25,7,0,4,[],"[{'screen_name': 'vidusky', 'name': 'sebasti치n davidovsky', 'id': '133312372'}, {'screen_name': 'perfildiario', 'name': 'diario perfil', 'id': '175881965'}]",False,,,,
1313100231974760448,1313100231974760448,"Extracto de La reinvenci칩n del amor, el nuevo libro de Sandra Russo, en @pagina12  https://t.co/HObM3YM9QO",megustaleerarg,316429650,2020-10-05,09:54:26,1,0,0,[],"[{'screen_name': 'pagina12', 'name': 'p치gina|12', 'id': '775474080715767808'}]",False,,,,
1312109309363253248,1312109309363253248,".@claudiapineiro es escritora, dramaturga, guionista de TV y colaboradora de distintos medios gr치ficos. Es una de las escritoras argentinas m치s traducidas a otros idiomas, lo que hace que sus libros sean le칤dos y disfrutados por miles de lectores en todo el mundo #ViernesDeCitas  https://t.co/Coco2aLFdG",megustaleerarg,316429650,2020-10-02,16:16:51,24,1,5,['viernesdecitas'],"[{'screen_name': 'claudiapineiro', 'name': 'claudia pi침eiro 游눜', 'id': '128205366'}]",False,,,,
